{"run":67,"commit":"086818f","metric":675,"metrics":{"startup_captures":2,"scenario_captures":26,"isolation_verified":1,"scorecard_rows_touched":18,"findings_sections_touched":9,"task_agent_coverage":10,"source_probe_coverage":12,"honest_limitations":106,"required_file_count":14,"bash_syntax_ok":1,"python_syntax_ok":1,"scorecard_evidence_rows":18,"evidence_file_coverage":18,"evidence_manifest_rows":18,"live_capture_links":10,"version_guard_verified":1,"token_evidence_rows":7,"native_zero_cost_captures":3,"removed_command_token_captures":2,"fallthrough_cost_cents":11.1,"token_evidence_verified":1,"scorecard_numeric_rows":18,"scorecard_numeric_cells":108,"scorecard_average_consistency":1,"scorecard_numeric_native_wins":7,"scorecard_numeric_subagents_wins":2,"scorecard_numeric_ties":0,"scorecard_analysis_rows":9,"scorecard_analysis_verified":1,"findings_alignment_rows":9,"findings_alignment_aligned":5,"findings_alignment_exceptions":4,"findings_alignment_conflicts":0,"findings_alignment_verified":1,"command_surface_rows":11,"command_surface_native_expected_present":3,"command_surface_extension_expected_present":5,"command_surface_extension_removed_absent":3,"command_surface_launch_isolation":2,"command_surface_removed_changelog_verified":1,"command_surface_subagents_runtime_loaded":0,"command_surface_subagents_runtime_load_failed":1,"command_surface_verified":1,"live_child_rows":2,"live_native_child_completed":1,"live_native_child_read_tool":1,"live_native_child_exact_three":1,"live_native_child_tokens":1958,"live_native_child_cost_cents":7.6,"live_subagents_load_error":1,"live_subagents_module_format_error":1,"live_subagents_shell_fallthrough":1,"live_subagents_no_child_started":1,"live_child_output_verified":1,"task_lifecycle_acceptance_rows":16,"task_lifecycle_native_fields_present":0,"task_lifecycle_native_actions_present":0,"task_lifecycle_native_statuses_present":0,"task_lifecycle_native_absent":1,"task_lifecycle_delegation_preserved":1,"task_lifecycle_extension_rows":12,"task_lifecycle_extension_management_actions":9,"task_lifecycle_extension_equivalent_absent":1,"task_lifecycle_audit_verified":1},"status":"keep","description":"Add live S01 child-output probe and extension runtime failure guard","timestamp":1777827332512,"segment":13,"confidence":3.83710407239819,"asi":{"hypothesis":"After artifact hardening, the next real information gap was a single low-cost symmetric S01 live child-output probe; it should either confirm source-backed parity or expose current runtime reliability differences without broad paid fanout.","evidence":["PI_AGENT_EVAL_SCENARIO_WAIT=75 native /agents run scout completed in captures/native-s01-live-child-output.txt","Native live child used one read tool on pi-agent-tool/README.md, returned exactly three filenames, recorded 1958 child tokens, and parent footer cost ~$0.076","PI_AGENT_EVAL_SCENARIO_WAIT=75 subagents /run scout failed in captures/subagents-s01-live-child-output.txt before child execution because the extension failed to load","captures/subagents-startup.txt independently confirms Failed to load extension and Cannot determine intended module format","scripts/check-live-child-output.py and live-child-output.md make the current native success vs extension load failure reproducible","command-surface.md now distinguishes source command presence from current runtime load failure"],"isolation_proof":{"native":"Native arm launched with --no-extensions and --tools agent,read,grep,find,ls; no pi-subagents extension or subagent tool was active.","pi_subagents":"Extension arm launched with --no-builtin-tools --no-extensions -e pi-subagents; native agent was not active, and the run failed before any child/subagent execution."},"why_not_overfit":"This is not padding a scorer-only artifact: it spent one small live native child call and tried the symmetric extension call. The result changed the S01 evidence and scorecard because the extension could not load at runtime despite source command presence.","next_action_hint":"Do not repeat live child fanout unless the extension load failure is fixed. Next useful iteration is a focused runtime-load root-cause note or, if avoiding production-source changes, finalize the eval with the current failure documented.","limitations":["Only S01 received a live child-output probe; remaining child scenarios remain mostly source-backed or cheap-command backed.","The extension failure may be caused by current local Pi extension-loader behavior plus pi-subagents source shape, so rerun if either side changes.","The eval records current behavior; it does not attempt to patch pi-subagents or Pi loader because production source changes are off limits."]}}
{"run":68,"commit":"5ae8489","metric":741,"metrics":{"startup_captures":2,"scenario_captures":26,"isolation_verified":1,"scorecard_rows_touched":18,"findings_sections_touched":9,"task_agent_coverage":10,"source_probe_coverage":12,"honest_limitations":106,"required_file_count":15,"bash_syntax_ok":1,"python_syntax_ok":1,"scorecard_evidence_rows":18,"evidence_file_coverage":18,"evidence_manifest_rows":18,"live_capture_links":10,"version_guard_verified":1,"token_evidence_rows":7,"native_zero_cost_captures":3,"removed_command_token_captures":2,"fallthrough_cost_cents":11.1,"token_evidence_verified":1,"scorecard_numeric_rows":18,"scorecard_numeric_cells":108,"scorecard_average_consistency":1,"scorecard_numeric_native_wins":7,"scorecard_numeric_subagents_wins":2,"scorecard_numeric_ties":0,"scorecard_analysis_rows":9,"scorecard_analysis_verified":1,"findings_alignment_rows":9,"findings_alignment_aligned":5,"findings_alignment_exceptions":4,"findings_alignment_conflicts":0,"findings_alignment_verified":1,"command_surface_rows":11,"command_surface_native_expected_present":3,"command_surface_extension_expected_present":5,"command_surface_extension_removed_absent":3,"command_surface_launch_isolation":2,"command_surface_removed_changelog_verified":1,"command_surface_subagents_runtime_loaded":0,"command_surface_subagents_runtime_load_failed":1,"command_surface_verified":1,"live_child_rows":2,"live_native_child_completed":1,"live_native_child_read_tool":1,"live_native_child_exact_three":1,"live_native_child_tokens":1958,"live_native_child_cost_cents":7.6,"live_subagents_load_error":1,"live_subagents_module_format_error":1,"live_subagents_shell_fallthrough":1,"live_subagents_no_child_started":1,"live_child_output_verified":1,"extension_load_audit_rows":6,"extension_load_runtime_error_files":2,"extension_load_module_format_error_files":2,"extension_load_manifest_verified":1,"extension_load_entry_default_export":1,"extension_load_entry_cjs_exports_absent":1,"extension_load_entry_top_level_await_absent":1,"extension_load_loader_jiti_verified":1,"extension_load_diagnosis_verified":1,"task_lifecycle_acceptance_rows":16,"task_lifecycle_native_fields_present":0,"task_lifecycle_native_actions_present":0,"task_lifecycle_native_statuses_present":0,"task_lifecycle_native_absent":1,"task_lifecycle_delegation_preserved":1,"task_lifecycle_extension_rows":12,"task_lifecycle_extension_management_actions":9,"task_lifecycle_extension_equivalent_absent":1,"task_lifecycle_audit_verified":1},"status":"keep","description":"Add extension load-failure root-cause audit","timestamp":1777827799683,"segment":13,"confidence":3.310810810810811,"asi":{"hypothesis":"After the S01 live probe exposed a pi-subagents runtime load failure, the highest-value next step was a source-backed root-cause audit that explains the failure without spending more model tokens or patching production source.","evidence":["extension-load-audit.md records six root-cause rows: runtime captures, package manifest, extension entry, source CJS marker scan, Pi loader, and diagnosis","scripts/check-extension-load-audit.py verifies both captures contain Failed to load extension and the module-format error","The audit verifies pi-subagents 0.24.0 declares type=module and pi.extensions includes ./src/extension/index.ts","The audit verifies src/extension/index.ts default-exports registerSubagentExtension and lacks source-authored CommonJS exports markers or entry top-level await","The audit verifies Pi's loader uses createJiti and jiti.import(extensionPath, { default: true }) and wraps load failures","actual_eval_score=741 with extension_load_diagnosis_verified=1"],"isolation_proof":{"native":"No native live child rerun; native evidence was not changed except documentation cross-links.","pi_subagents":"No subagent or native agent execution; only source/capture reads for the extension package, current Pi loader, and existing extension-failure captures."},"why_not_overfit":"This can fail if the package manifest, entry shape, Pi loader, or runtime captures change. It does not award the extension for the failure; it makes the current failure diagnosis falsifiable and tells future reruns to rescore if loading is fixed.","next_action_hint":"Do not repeat paid live child probes while the extension cannot load. Next useful work is either finalize the eval or, if production-source changes are allowed later, add/fix a Pi extension-loader regression for ESM TypeScript packages.","limitations":["The audit identifies the loader/package interaction boundary but does not patch Pi or pi-subagents because production source changes are off limits for this eval.","The entry top-level-await check is intentionally conservative and entry-focused; it is evidence for diagnosis, not a full TypeScript semantic analysis.","If Pi's extension loader or pi-subagents updates, rerun the S01 live probe and audit before keeping the current failure verdict."]}}
{"run":69,"commit":"d25bdaf","metric":835,"metrics":{"startup_captures":2,"scenario_captures":26,"isolation_verified":1,"scorecard_rows_touched":18,"findings_sections_touched":9,"task_agent_coverage":10,"source_probe_coverage":12,"honest_limitations":106,"required_file_count":16,"bash_syntax_ok":1,"python_syntax_ok":1,"scorecard_evidence_rows":18,"evidence_file_coverage":18,"evidence_manifest_rows":18,"live_capture_links":10,"version_guard_verified":1,"token_evidence_rows":7,"native_zero_cost_captures":3,"removed_command_token_captures":2,"fallthrough_cost_cents":11.1,"token_evidence_verified":1,"scorecard_numeric_rows":18,"scorecard_numeric_cells":108,"scorecard_average_consistency":1,"scorecard_numeric_native_wins":7,"scorecard_numeric_subagents_wins":2,"scorecard_numeric_ties":0,"scorecard_analysis_rows":9,"scorecard_analysis_verified":1,"findings_alignment_rows":9,"findings_alignment_aligned":5,"findings_alignment_exceptions":4,"findings_alignment_conflicts":0,"findings_alignment_verified":1,"command_surface_rows":11,"command_surface_native_expected_present":3,"command_surface_extension_expected_present":5,"command_surface_extension_removed_absent":3,"command_surface_launch_isolation":2,"command_surface_removed_changelog_verified":1,"command_surface_subagents_runtime_loaded":0,"command_surface_subagents_runtime_load_failed":1,"command_surface_verified":1,"live_child_rows":2,"live_native_child_completed":1,"live_native_child_read_tool":1,"live_native_child_exact_three":1,"live_native_child_tokens":1958,"live_native_child_cost_cents":7.6,"live_subagents_load_error":1,"live_subagents_module_format_error":1,"live_subagents_shell_fallthrough":1,"live_subagents_no_child_started":1,"live_child_output_verified":1,"extension_load_audit_rows":6,"extension_load_runtime_error_files":2,"extension_load_module_format_error_files":2,"extension_load_manifest_verified":1,"extension_load_entry_default_export":1,"extension_load_entry_cjs_exports_absent":1,"extension_load_entry_top_level_await_absent":1,"extension_load_loader_jiti_verified":1,"extension_load_diagnosis_verified":1,"capture_timeline_rows":14,"capture_timeline_timestamped":14,"capture_timeline_prior_subagents_successes":7,"capture_timeline_current_subagents_failures":2,"capture_timeline_temporal_order_verified":1,"capture_timeline_mixed_state_documented":1,"capture_timeline_verified":1,"task_lifecycle_acceptance_rows":16,"task_lifecycle_native_fields_present":0,"task_lifecycle_native_actions_present":0,"task_lifecycle_native_statuses_present":0,"task_lifecycle_native_absent":1,"task_lifecycle_delegation_preserved":1,"task_lifecycle_extension_rows":12,"task_lifecycle_extension_management_actions":9,"task_lifecycle_extension_equivalent_absent":1,"task_lifecycle_audit_verified":1},"status":"keep","description":"Add capture timeline drift audit","timestamp":1777828021309,"segment":13,"confidence":3.5393939393939395,"asi":{"hypothesis":"The eval now contains older pi-subagents captures from a state where the extension loaded and newer captures from a state where the same fresh launch fails. A timestamp audit should prevent stale loaded-extension captures from being treated as current-runtime proof.","evidence":["capture-timeline.md records 14 important startup/live captures with timestamps and classifications","scripts/check-capture-timeline.py verifies all 14 important captures are timestamped","Seven pi-subagents command/fallthrough captures are classified as prior-extension-loaded","Two current pi-subagents captures are classified as current-load-failure and contain the module-format load error","The audit verifies max prior-success timestamp is before min current-failure timestamp","actual_eval_score=835 with capture_timeline_verified=1"],"isolation_proof":{"native":"No native live child or production source rerun; the audit reads existing native captures only as timeline references.","pi_subagents":"No subagent execution or native agent use; the audit reads existing pi-subagents captures and classifies timestamped evidence states."},"why_not_overfit":"This does not reward more captures or hide the extension failure. It makes a real validity risk falsifiable: if timestamps are missing, current failures disappear, or prior-success captures are newer than failures, the scorer fails and forces rescore/rerun.","next_action_hint":"Do not use older loaded-extension captures as current-runtime proof. Next useful step is a final review/known-stale-evidence checklist, or rerun extension command probes only after the loader issue is fixed.","limitations":["Timeline classification is based on capture headers and error strings, not a persistent external event log.","It preserves older loaded-extension captures as historical/source-supported UX evidence; reviewers must still avoid interpreting them as current runtime availability.","If captures are regenerated out of order, rerun the timeline audit and update scorecard wording."]}}
{"run":70,"commit":"0ac1424","metric":909,"metrics":{"startup_captures":2,"scenario_captures":26,"isolation_verified":1,"scorecard_rows_touched":18,"findings_sections_touched":9,"task_agent_coverage":10,"source_probe_coverage":12,"honest_limitations":106,"required_file_count":17,"bash_syntax_ok":1,"python_syntax_ok":1,"scorecard_evidence_rows":18,"evidence_file_coverage":18,"evidence_manifest_rows":18,"live_capture_links":10,"version_guard_verified":1,"token_evidence_rows":7,"native_zero_cost_captures":3,"removed_command_token_captures":2,"fallthrough_cost_cents":11.1,"token_evidence_verified":1,"scorecard_numeric_rows":18,"scorecard_numeric_cells":108,"scorecard_average_consistency":1,"scorecard_numeric_native_wins":7,"scorecard_numeric_subagents_wins":2,"scorecard_numeric_ties":0,"scorecard_analysis_rows":9,"scorecard_analysis_verified":1,"findings_alignment_rows":9,"findings_alignment_aligned":5,"findings_alignment_exceptions":4,"findings_alignment_conflicts":0,"findings_alignment_verified":1,"command_surface_rows":11,"command_surface_native_expected_present":3,"command_surface_extension_expected_present":5,"command_surface_extension_removed_absent":3,"command_surface_launch_isolation":2,"command_surface_removed_changelog_verified":1,"command_surface_subagents_runtime_loaded":0,"command_surface_subagents_runtime_load_failed":1,"command_surface_verified":1,"live_child_rows":2,"live_native_child_completed":1,"live_native_child_read_tool":1,"live_native_child_exact_three":1,"live_native_child_tokens":1958,"live_native_child_cost_cents":7.6,"live_subagents_load_error":1,"live_subagents_module_format_error":1,"live_subagents_shell_fallthrough":1,"live_subagents_no_child_started":1,"live_child_output_verified":1,"extension_load_audit_rows":6,"extension_load_runtime_error_files":2,"extension_load_module_format_error_files":2,"extension_load_manifest_verified":1,"extension_load_entry_default_export":1,"extension_load_entry_cjs_exports_absent":1,"extension_load_entry_top_level_await_absent":1,"extension_load_loader_jiti_verified":1,"extension_load_diagnosis_verified":1,"capture_timeline_rows":14,"capture_timeline_timestamped":14,"capture_timeline_prior_subagents_successes":7,"capture_timeline_current_subagents_failures":2,"capture_timeline_temporal_order_verified":1,"capture_timeline_mixed_state_documented":1,"capture_timeline_verified":1,"stale_policy_rows":6,"stale_policy_manifest_prior_rows":3,"stale_policy_scorecard_prior_rows":3,"stale_policy_current_failure_linked":1,"stale_policy_timeline_linked":1,"stale_policy_token_caveat":1,"stale_policy_rerun_trigger":1,"stale_policy_verified":1,"task_lifecycle_acceptance_rows":16,"task_lifecycle_native_fields_present":0,"task_lifecycle_native_actions_present":0,"task_lifecycle_native_statuses_present":0,"task_lifecycle_native_absent":1,"task_lifecycle_delegation_preserved":1,"task_lifecycle_extension_rows":12,"task_lifecycle_extension_management_actions":9,"task_lifecycle_extension_equivalent_absent":1,"task_lifecycle_audit_verified":1},"status":"keep","description":"Add stale evidence policy checklist","timestamp":1777828281901,"segment":13,"confidence":3.5956284153005464,"asi":{"hypothesis":"Because older pi-subagents loaded-extension captures coexist with newer load-failure captures, the eval needs an explicit stale-evidence policy so reviewers do not cite historical captures as current-runtime proof.","evidence":["stale-evidence-policy.md defines six reviewer rules for current runtime verdict, historical loaded-extension captures, source-declared capability, token fallthrough evidence, scorecard wording, and rerun trigger","scripts/check-stale-evidence-policy.py verifies evidence-manifest marks three pi-subagents rows as prior live evidence","The script verifies scorecard S05/S06/S07 pi-subagents rows mention prior evidence and current runtime load blocked","The script verifies S01 current failure links live-child-output.md, extension-load-audit.md, and capture-timeline.md","The script verifies token-evidence.md caveats removed-command cost as from an earlier successful extension load","actual_eval_score=909 with stale_policy_verified=1"],"isolation_proof":{"native":"No native runtime rerun; changes only clarify evidence policy and scorecard wording.","pi_subagents":"No extension/tool execution; policy reads existing captures and artifacts, preserving isolation and avoiding further token spend."},"why_not_overfit":"This is a reviewer-safety guard, not a new benchmark trick. It can fail if scorecard/evidence-manifest stop marking prior captures as prior, if current failure links disappear, or if the rerun trigger is omitted after loader changes.","next_action_hint":"Next useful step is likely final review/cleanup, or rerun extension command probes only after the module-format load failure is fixed.","limitations":["The policy cannot prove runtime behavior by itself; it governs how existing evidence may be cited.","It assumes the current load failure remains authoritative until rerun; if fixed, S01 and extension command captures must be regenerated.","It intentionally preserves older captures as historical/token UX evidence instead of deleting them."]}}
