{"run":83,"commit":"8aff15f","metric":1778,"metrics":{"startup_captures":2,"scenario_captures":26,"isolation_verified":1,"scorecard_rows_touched":18,"findings_sections_touched":9,"task_agent_coverage":10,"source_probe_coverage":12,"honest_limitations":106,"required_file_count":31,"bash_syntax_ok":1,"python_syntax_ok":1,"scorecard_evidence_rows":18,"evidence_file_coverage":18,"evidence_manifest_rows":18,"live_capture_links":10,"version_guard_verified":1,"token_evidence_rows":7,"native_zero_cost_captures":3,"removed_command_token_captures":2,"fallthrough_cost_cents":11.1,"token_evidence_verified":1,"scorecard_numeric_rows":18,"scorecard_numeric_cells":108,"scorecard_average_consistency":1,"scorecard_numeric_native_wins":7,"scorecard_numeric_subagents_wins":2,"scorecard_numeric_ties":0,"scorecard_analysis_rows":9,"scorecard_analysis_verified":1,"findings_alignment_rows":9,"findings_alignment_aligned":5,"findings_alignment_exceptions":4,"findings_alignment_conflicts":0,"findings_alignment_verified":1,"command_surface_rows":11,"command_surface_native_expected_present":3,"command_surface_extension_expected_present":5,"command_surface_extension_removed_absent":3,"command_surface_launch_isolation":2,"command_surface_removed_changelog_verified":1,"command_surface_subagents_runtime_loaded":0,"command_surface_subagents_runtime_load_failed":1,"command_surface_markdown_guardrail_split":1,"command_surface_verified":1,"live_child_rows":2,"live_native_child_completed":1,"live_native_child_read_tool":1,"live_native_child_exact_three":1,"live_native_child_tokens":1958,"live_native_child_cost_cents":7.6,"live_subagents_load_error":1,"live_subagents_module_format_error":1,"live_subagents_shell_fallthrough":1,"live_subagents_no_child_started":1,"live_child_output_verified":1,"extension_load_audit_rows":6,"extension_load_runtime_error_files":2,"extension_load_module_format_error_files":2,"extension_load_manifest_verified":1,"extension_load_entry_default_export":1,"extension_load_entry_cjs_exports_absent":1,"extension_load_entry_top_level_await_absent":1,"extension_load_loader_jiti_verified":1,"extension_load_diagnosis_verified":1,"capture_timeline_rows":14,"capture_timeline_timestamped":14,"capture_timeline_prior_subagents_successes":7,"capture_timeline_current_subagents_failures":2,"capture_timeline_temporal_order_verified":1,"capture_timeline_mixed_state_documented":1,"capture_timeline_verified":1,"stale_policy_rows":6,"stale_policy_manifest_prior_rows":3,"stale_policy_scorecard_prior_rows":3,"stale_policy_current_failure_linked":1,"stale_policy_timeline_linked":1,"stale_policy_token_caveat":1,"stale_policy_rerun_trigger":1,"stale_policy_verified":1,"token_accounting_rows":7,"token_accounting_native_zero_rows":3,"token_accounting_native_child_cost_present":1,"token_accounting_extension_removed_cost_present":1,"token_accounting_current_extension_no_child_present":1,"token_accounting_scorecard_intro_aligned":1,"token_accounting_findings_metadata_aligned":1,"token_accounting_token_conclusion_caveated":1,"token_accounting_observed_cost_cents":18.7,"token_accounting_verified":1,"repro_hygiene_rows":5,"repro_hygiene_python_glob":1,"repro_hygiene_no_py_compile":1,"repro_hygiene_compile_in_memory":1,"repro_hygiene_pycache_clean":1,"repro_hygiene_verified":1,"recommendation_consistency_rows":6,"recommendation_exec_runtime_caveat":1,"recommendation_s05_caveat":1,"recommendation_final_blocks_current_runtime":1,"recommendation_native_default":1,"recommendation_rerun_trigger":1,"recommendation_removed_slash_protection":1,"recommendation_consistency_verified":1,"rerun_readme_commands_expected":31,"rerun_readme_commands_present":31,"rerun_runbook_anchors_expected":20,"rerun_runbook_anchors_present":20,"rerun_readme_removed_manager_probe":1,"rerun_readme_live_child_checker":1,"rerun_readme_write_generators":1,"rerun_commands_verified":1,"eval_plan_currentness_rows":6,"eval_plan_s01_native_live_child":1,"eval_plan_s01_subagents_load_failure":1,"eval_plan_no_stale_no_live_child":1,"eval_plan_runtime_caveat":1,"eval_plan_token_caveat":1,"eval_plan_secondary_metrics_delegated":1,"eval_plan_currentness_verified":1,"scorecard_template_rows":18,"scorecard_template_warning":1,"scorecard_template_current_columns":1,"scorecard_template_placeholder_rows":18,"scorecard_template_no_stale_claims":1,"scorecard_template_verified":1,"findings_template_headings_expected":18,"findings_template_headings_present":18,"findings_template_warning":1,"findings_template_placeholder_count":128,"findings_template_no_stale_claims":1,"findings_template_verified":1,"eval_design_prompt_warning":1,"eval_design_prompt_current_caveats_expected":12,"eval_design_prompt_current_caveats":12,"eval_design_prompt_no_stale_lines":1,"eval_design_prompt_verified":1,"artifact_index_required_files":31,"artifact_index_readme_required_present":31,"artifact_index_readme_directory_entries":2,"artifact_index_manifest_audited_expected":22,"artifact_index_manifest_audited_present":22,"artifact_index_required_files_exist":31,"artifact_index_verified":1,"scenario_verdict_rows":18,"scenario_verdict_current_live_rows":4,"scenario_verdict_current_failure_rows":1,"scenario_verdict_prior_live_rows":3,"scenario_verdict_source_backed_rows":10,"scenario_verdict_unknown_rows":0,"scenario_verdict_scorecard_prior_rows":3,"scenario_verdict_scorecard_current_failure":1,"scenario_verdict_scorecard_native_live_child":1,"scenario_verdict_findings_no_stale_false_claim":1,"scenario_verdict_findings_one_tiny_live_claim":1,"scenario_verdict_findings_current_failure_claim":1,"scenario_verdict_verified":1,"source_runtime_extension_source_rows":5,"source_runtime_scorecard_rows_caveated":5,"source_runtime_manifest_rows_caveated":5,"source_runtime_eval_plan_rows_caveated":5,"source_runtime_eval_plan_global_caveat":1,"source_runtime_scenario_rule_caveat":1,"source_runtime_boundary_verified":1,"task_lifecycle_acceptance_rows":16,"task_lifecycle_native_fields_present":0,"task_lifecycle_native_actions_present":0,"task_lifecycle_native_statuses_present":0,"task_lifecycle_native_control_fields_present":3,"task_lifecycle_native_control_actions_present":5,"task_lifecycle_native_control_not_task_lifecycle":1,"task_lifecycle_native_absent":1,"task_lifecycle_delegation_preserved":1,"task_lifecycle_extension_rows":12,"task_lifecycle_extension_management_actions":9,"task_lifecycle_extension_equivalent_absent":1,"task_lifecycle_audit_verified":1},"status":"keep","description":"Currentize seed prompt and split native control from task lifecycle","timestamp":1777832369255,"segment":13,"confidence":3.478359908883827,"asi":{"hypothesis":"A stale seed prompt and an overbroad S09 lifecycle audit were the next concrete defects: eval-design-prompt.md still treated removed pi-subagents slash surfaces as active, and task-lifecycle audit could mistake generic native background-control action/runId for task-record lifecycle. Adding a seed-prompt currentness audit and splitting generic native control from lifecycle should improve reviewer correctness without new paid probes.","evidence":"./autoresearch.sh passed with actual_eval_score=1778; eval_design_prompt_verified=1; task_lifecycle_native_control_not_task_lifecycle=1; task_lifecycle_audit_verified=1.","next_action_hint":"Next sweep should specifically address whether native background-control source changes require an S05 scorecard/currentness update or a dirty-source caveat before treating them as accepted runtime behavior. Do not rerun paid child probes unless the extension loader is fixed."}}
{"run":84,"commit":"8aff15f","metric":1835,"metrics":{"startup_captures":2,"scenario_captures":26,"isolation_verified":1,"scorecard_rows_touched":18,"findings_sections_touched":9,"task_agent_coverage":10,"source_probe_coverage":12,"honest_limitations":106,"required_file_count":32,"bash_syntax_ok":1,"python_syntax_ok":1,"scorecard_evidence_rows":18,"evidence_file_coverage":18,"evidence_manifest_rows":18,"live_capture_links":10,"version_guard_verified":1,"token_evidence_rows":7,"native_zero_cost_captures":3,"removed_command_token_captures":2,"fallthrough_cost_cents":11.1,"token_evidence_verified":1,"scorecard_numeric_rows":18,"scorecard_numeric_cells":108,"scorecard_average_consistency":1,"scorecard_numeric_native_wins":8,"scorecard_numeric_subagents_wins":1,"scorecard_numeric_ties":0,"scorecard_analysis_rows":9,"scorecard_analysis_verified":1,"findings_alignment_rows":9,"findings_alignment_aligned":5,"findings_alignment_exceptions":4,"findings_alignment_conflicts":0,"findings_alignment_verified":1,"command_surface_rows":11,"command_surface_native_expected_present":3,"command_surface_extension_expected_present":5,"command_surface_extension_removed_absent":3,"command_surface_launch_isolation":2,"command_surface_removed_changelog_verified":1,"command_surface_subagents_runtime_loaded":0,"command_surface_subagents_runtime_load_failed":1,"command_surface_markdown_guardrail_split":1,"command_surface_verified":1,"live_child_rows":2,"live_native_child_completed":1,"live_native_child_read_tool":1,"live_native_child_exact_three":1,"live_native_child_tokens":1958,"live_native_child_cost_cents":7.6,"live_subagents_load_error":1,"live_subagents_module_format_error":1,"live_subagents_shell_fallthrough":1,"live_subagents_no_child_started":1,"live_child_output_verified":1,"extension_load_audit_rows":6,"extension_load_runtime_error_files":2,"extension_load_module_format_error_files":2,"extension_load_manifest_verified":1,"extension_load_entry_default_export":1,"extension_load_entry_cjs_exports_absent":1,"extension_load_entry_top_level_await_absent":1,"extension_load_loader_jiti_verified":1,"extension_load_diagnosis_verified":1,"capture_timeline_rows":14,"capture_timeline_timestamped":14,"capture_timeline_prior_subagents_successes":7,"capture_timeline_current_subagents_failures":2,"capture_timeline_temporal_order_verified":1,"capture_timeline_mixed_state_documented":1,"capture_timeline_verified":1,"stale_policy_rows":6,"stale_policy_manifest_prior_rows":3,"stale_policy_scorecard_prior_rows":3,"stale_policy_current_failure_linked":1,"stale_policy_timeline_linked":1,"stale_policy_token_caveat":1,"stale_policy_rerun_trigger":1,"stale_policy_verified":1,"token_accounting_rows":7,"token_accounting_native_zero_rows":3,"token_accounting_native_child_cost_present":1,"token_accounting_extension_removed_cost_present":1,"token_accounting_current_extension_no_child_present":1,"token_accounting_scorecard_intro_aligned":1,"token_accounting_findings_metadata_aligned":1,"token_accounting_token_conclusion_caveated":1,"token_accounting_observed_cost_cents":18.7,"token_accounting_verified":1,"repro_hygiene_rows":5,"repro_hygiene_python_glob":1,"repro_hygiene_no_py_compile":1,"repro_hygiene_compile_in_memory":1,"repro_hygiene_pycache_clean":1,"repro_hygiene_verified":1,"recommendation_consistency_rows":6,"recommendation_exec_runtime_caveat":1,"recommendation_s05_caveat":1,"recommendation_final_blocks_current_runtime":1,"recommendation_native_default":1,"recommendation_rerun_trigger":1,"recommendation_removed_slash_protection":1,"recommendation_consistency_verified":1,"native_control_source_markers_expected":8,"native_control_source_markers":8,"native_control_status_source":1,"native_control_status_capture":1,"native_control_source_capture":1,"native_control_scorecard_current":1,"native_control_findings_current":1,"native_control_no_stale_unsupported":1,"native_control_currentness_verified":1,"rerun_readme_commands_expected":32,"rerun_readme_commands_present":32,"rerun_runbook_anchors_expected":21,"rerun_runbook_anchors_present":21,"rerun_readme_removed_manager_probe":1,"rerun_readme_live_child_checker":1,"rerun_readme_write_generators":1,"rerun_commands_verified":1,"eval_plan_currentness_rows":6,"eval_plan_s01_native_live_child":1,"eval_plan_s01_subagents_load_failure":1,"eval_plan_no_stale_no_live_child":1,"eval_plan_runtime_caveat":1,"eval_plan_token_caveat":1,"eval_plan_secondary_metrics_delegated":1,"eval_plan_currentness_verified":1,"scorecard_template_rows":18,"scorecard_template_warning":1,"scorecard_template_current_columns":1,"scorecard_template_placeholder_rows":18,"scorecard_template_no_stale_claims":1,"scorecard_template_verified":1,"findings_template_headings_expected":18,"findings_template_headings_present":18,"findings_template_warning":1,"findings_template_placeholder_count":128,"findings_template_no_stale_claims":1,"findings_template_verified":1,"eval_design_prompt_warning":1,"eval_design_prompt_current_caveats_expected":12,"eval_design_prompt_current_caveats":12,"eval_design_prompt_no_stale_lines":1,"eval_design_prompt_verified":1,"artifact_index_required_files":32,"artifact_index_readme_required_present":32,"artifact_index_readme_directory_entries":2,"artifact_index_manifest_audited_expected":23,"artifact_index_manifest_audited_present":23,"artifact_index_required_files_exist":32,"artifact_index_verified":1,"scenario_verdict_rows":18,"scenario_verdict_current_live_rows":4,"scenario_verdict_current_failure_rows":1,"scenario_verdict_prior_live_rows":3,"scenario_verdict_source_backed_rows":10,"scenario_verdict_unknown_rows":0,"scenario_verdict_scorecard_prior_rows":3,"scenario_verdict_scorecard_current_failure":1,"scenario_verdict_scorecard_native_live_child":1,"scenario_verdict_findings_no_stale_false_claim":1,"scenario_verdict_findings_one_tiny_live_claim":1,"scenario_verdict_findings_current_failure_claim":1,"scenario_verdict_verified":1,"source_runtime_extension_source_rows":5,"source_runtime_scorecard_rows_caveated":5,"source_runtime_manifest_rows_caveated":5,"source_runtime_eval_plan_rows_caveated":5,"source_runtime_eval_plan_global_caveat":1,"source_runtime_scenario_rule_caveat":1,"source_runtime_boundary_verified":1,"task_lifecycle_acceptance_rows":16,"task_lifecycle_native_fields_present":0,"task_lifecycle_native_actions_present":0,"task_lifecycle_native_statuses_present":0,"task_lifecycle_native_control_fields_present":3,"task_lifecycle_native_control_actions_present":5,"task_lifecycle_native_control_not_task_lifecycle":1,"task_lifecycle_native_absent":1,"task_lifecycle_delegation_preserved":1,"task_lifecycle_extension_rows":12,"task_lifecycle_extension_management_actions":9,"task_lifecycle_extension_equivalent_absent":1,"task_lifecycle_audit_verified":1},"status":"keep","description":"Align S05 with native background control landing","timestamp":1777833052900,"segment":13,"confidence":3.3918629550321198,"asi":{"hypothesis":"Native background-run control landed in source and passed npm run check, but S05 artifacts still said native background control was unsupported. Rerunning source probes and the cheap /agents-status capture, updating scorecard/findings, and adding a native-control currentness audit should prevent stale S05 conclusions while keeping S09 task lifecycle separate.","evidence":"./autoresearch.sh passed with actual_eval_score=1835; scorecard_numeric_native_wins=8; scorecard_numeric_subagents_wins=1; native_control_currentness_verified=1; task_lifecycle_native_control_not_task_lifecycle=1.","next_action_hint":"Continue stale/currentness sweep only for concrete issues. If extension loader is fixed, rerun pi-subagents S01 and cheap command probes; otherwise avoid more paid probes."}}
