{"run":71,"commit":"75be03c","metric":1029,"metrics":{"startup_captures":2,"scenario_captures":26,"isolation_verified":1,"scorecard_rows_touched":18,"findings_sections_touched":9,"task_agent_coverage":10,"source_probe_coverage":12,"honest_limitations":105,"required_file_count":18,"bash_syntax_ok":1,"python_syntax_ok":1,"scorecard_evidence_rows":18,"evidence_file_coverage":18,"evidence_manifest_rows":18,"live_capture_links":10,"version_guard_verified":1,"token_evidence_rows":7,"native_zero_cost_captures":3,"removed_command_token_captures":2,"fallthrough_cost_cents":11.1,"token_evidence_verified":1,"scorecard_numeric_rows":18,"scorecard_numeric_cells":108,"scorecard_average_consistency":1,"scorecard_numeric_native_wins":7,"scorecard_numeric_subagents_wins":2,"scorecard_numeric_ties":0,"scorecard_analysis_rows":9,"scorecard_analysis_verified":1,"findings_alignment_rows":9,"findings_alignment_aligned":5,"findings_alignment_exceptions":4,"findings_alignment_conflicts":0,"findings_alignment_verified":1,"command_surface_rows":11,"command_surface_native_expected_present":3,"command_surface_extension_expected_present":5,"command_surface_extension_removed_absent":3,"command_surface_launch_isolation":2,"command_surface_removed_changelog_verified":1,"command_surface_subagents_runtime_loaded":0,"command_surface_subagents_runtime_load_failed":1,"command_surface_verified":1,"live_child_rows":2,"live_native_child_completed":1,"live_native_child_read_tool":1,"live_native_child_exact_three":1,"live_native_child_tokens":1958,"live_native_child_cost_cents":7.6,"live_subagents_load_error":1,"live_subagents_module_format_error":1,"live_subagents_shell_fallthrough":1,"live_subagents_no_child_started":1,"live_child_output_verified":1,"extension_load_audit_rows":6,"extension_load_runtime_error_files":2,"extension_load_module_format_error_files":2,"extension_load_manifest_verified":1,"extension_load_entry_default_export":1,"extension_load_entry_cjs_exports_absent":1,"extension_load_entry_top_level_await_absent":1,"extension_load_loader_jiti_verified":1,"extension_load_diagnosis_verified":1,"capture_timeline_rows":14,"capture_timeline_timestamped":14,"capture_timeline_prior_subagents_successes":7,"capture_timeline_current_subagents_failures":2,"capture_timeline_temporal_order_verified":1,"capture_timeline_mixed_state_documented":1,"capture_timeline_verified":1,"stale_policy_rows":6,"stale_policy_manifest_prior_rows":3,"stale_policy_scorecard_prior_rows":3,"stale_policy_current_failure_linked":1,"stale_policy_timeline_linked":1,"stale_policy_token_caveat":1,"stale_policy_rerun_trigger":1,"stale_policy_verified":1,"scenario_verdict_rows":18,"scenario_verdict_current_live_rows":4,"scenario_verdict_current_failure_rows":1,"scenario_verdict_prior_live_rows":3,"scenario_verdict_source_backed_rows":10,"scenario_verdict_unknown_rows":0,"scenario_verdict_scorecard_prior_rows":3,"scenario_verdict_scorecard_current_failure":1,"scenario_verdict_scorecard_native_live_child":1,"scenario_verdict_findings_no_stale_false_claim":1,"scenario_verdict_findings_one_tiny_live_claim":1,"scenario_verdict_findings_current_failure_claim":1,"scenario_verdict_verified":1,"task_lifecycle_acceptance_rows":16,"task_lifecycle_native_fields_present":0,"task_lifecycle_native_actions_present":0,"task_lifecycle_native_statuses_present":0,"task_lifecycle_native_absent":1,"task_lifecycle_delegation_preserved":1,"task_lifecycle_extension_rows":12,"task_lifecycle_extension_management_actions":9,"task_lifecycle_extension_equivalent_absent":1,"task_lifecycle_audit_verified":1},"status":"keep","description":"Add scenario verdict evidence-class audit","timestamp":1777828534153,"segment":13,"confidence":3.9292929292929295,"asi":{"hypothesis":"The eval has enough artifacts that the remaining risk is semantic ambiguity: a final scenario-verdict audit should classify each scorecard row by evidence class so current runtime, prior runtime, and source-backed claims cannot be blended.","evidence":["scenario-verdict-audit.md classifies all 18 scorecard rows by evidence class","scripts/check-scenario-verdicts.py verifies 4 current-live rows, 1 current-load-failure row, 3 prior-live rows, 10 source-backed rows, and 0 unknown rows","The audit verifies scorecard S05/S06/S07 pi-subagents rows are prior/current-blocked, S01 pi-subagents is current failure, and S01 native is a live child output","The audit caught and fixed a stale findings limitation that still claimed no live child-agent outputs existed after the native S01 live probe","actual_eval_score=1029 with scenario_verdict_verified=1"],"isolation_proof":{"native":"No native or extension runtime execution; the audit reads existing manifest, scorecard, and findings only.","pi_subagents":"No subagent execution or native agent use; the audit classifies existing pi-subagents evidence and preserves the current load-failure verdict."},"why_not_overfit":"This is not adding new benchmark padding. It enforces a falsifiable reviewer invariant: every scored row must have exactly one evidence class, no unknowns, and findings must not contain stale claims that contradict live evidence.","next_action_hint":"Next useful step is final review/cleanup or stop/finalize. Do not rerun extension command probes until the module-format load failure is fixed.","limitations":["Evidence classes are derived from the manifest wording, so future manifest wording changes should update the classifier deliberately.","The audit does not add new runtime behavior evidence; it makes the existing evidence safer to interpret.","Current pi-subagents runtime availability remains blocked until rerun after a loader fix."]}}
{"run":72,"commit":"bb719aa","metric":1101,"metrics":{"startup_captures":2,"scenario_captures":26,"isolation_verified":1,"scorecard_rows_touched":18,"findings_sections_touched":9,"task_agent_coverage":10,"source_probe_coverage":12,"honest_limitations":106,"required_file_count":19,"bash_syntax_ok":1,"python_syntax_ok":1,"scorecard_evidence_rows":18,"evidence_file_coverage":18,"evidence_manifest_rows":18,"live_capture_links":10,"version_guard_verified":1,"token_evidence_rows":7,"native_zero_cost_captures":3,"removed_command_token_captures":2,"fallthrough_cost_cents":11.1,"token_evidence_verified":1,"scorecard_numeric_rows":18,"scorecard_numeric_cells":108,"scorecard_average_consistency":1,"scorecard_numeric_native_wins":7,"scorecard_numeric_subagents_wins":2,"scorecard_numeric_ties":0,"scorecard_analysis_rows":9,"scorecard_analysis_verified":1,"findings_alignment_rows":9,"findings_alignment_aligned":5,"findings_alignment_exceptions":4,"findings_alignment_conflicts":0,"findings_alignment_verified":1,"command_surface_rows":11,"command_surface_native_expected_present":3,"command_surface_extension_expected_present":5,"command_surface_extension_removed_absent":3,"command_surface_launch_isolation":2,"command_surface_removed_changelog_verified":1,"command_surface_subagents_runtime_loaded":0,"command_surface_subagents_runtime_load_failed":1,"command_surface_verified":1,"live_child_rows":2,"live_native_child_completed":1,"live_native_child_read_tool":1,"live_native_child_exact_three":1,"live_native_child_tokens":1958,"live_native_child_cost_cents":7.6,"live_subagents_load_error":1,"live_subagents_module_format_error":1,"live_subagents_shell_fallthrough":1,"live_subagents_no_child_started":1,"live_child_output_verified":1,"extension_load_audit_rows":6,"extension_load_runtime_error_files":2,"extension_load_module_format_error_files":2,"extension_load_manifest_verified":1,"extension_load_entry_default_export":1,"extension_load_entry_cjs_exports_absent":1,"extension_load_entry_top_level_await_absent":1,"extension_load_loader_jiti_verified":1,"extension_load_diagnosis_verified":1,"capture_timeline_rows":14,"capture_timeline_timestamped":14,"capture_timeline_prior_subagents_successes":7,"capture_timeline_current_subagents_failures":2,"capture_timeline_temporal_order_verified":1,"capture_timeline_mixed_state_documented":1,"capture_timeline_verified":1,"stale_policy_rows":6,"stale_policy_manifest_prior_rows":3,"stale_policy_scorecard_prior_rows":3,"stale_policy_current_failure_linked":1,"stale_policy_timeline_linked":1,"stale_policy_token_caveat":1,"stale_policy_rerun_trigger":1,"stale_policy_verified":1,"token_accounting_rows":7,"token_accounting_native_zero_rows":3,"token_accounting_native_child_cost_present":1,"token_accounting_extension_removed_cost_present":1,"token_accounting_current_extension_no_child_present":1,"token_accounting_scorecard_intro_aligned":1,"token_accounting_findings_metadata_aligned":1,"token_accounting_token_conclusion_caveated":1,"token_accounting_observed_cost_cents":18.7,"token_accounting_verified":1,"scenario_verdict_rows":18,"scenario_verdict_current_live_rows":4,"scenario_verdict_current_failure_rows":1,"scenario_verdict_prior_live_rows":3,"scenario_verdict_source_backed_rows":10,"scenario_verdict_unknown_rows":0,"scenario_verdict_scorecard_prior_rows":3,"scenario_verdict_scorecard_current_failure":1,"scenario_verdict_scorecard_native_live_child":1,"scenario_verdict_findings_no_stale_false_claim":1,"scenario_verdict_findings_one_tiny_live_claim":1,"scenario_verdict_findings_current_failure_claim":1,"scenario_verdict_verified":1,"task_lifecycle_acceptance_rows":16,"task_lifecycle_native_fields_present":0,"task_lifecycle_native_actions_present":0,"task_lifecycle_native_statuses_present":0,"task_lifecycle_native_absent":1,"task_lifecycle_delegation_preserved":1,"task_lifecycle_extension_rows":12,"task_lifecycle_extension_management_actions":9,"task_lifecycle_extension_equivalent_absent":1,"task_lifecycle_audit_verified":1},"status":"keep","description":"Add token accounting consistency audit","timestamp":1777828795310,"segment":13,"confidence":3.7610619469026547,"asi":{"hypothesis":"After adding one native S01 live child run, stale model-call/token wording could mislead reviewers by still implying no paid child runs or no native model cost. A token-accounting audit should align findings, scorecard, token evidence, and live child output.","evidence":["token-accounting-audit.md records seven token evidence rows, three zero-cost native registered command probes, one native S01 child cost, prior extension fallthrough cost, and current extension no-child caveat","scripts/check-token-accounting.py verifies scorecard intro says most token fields are n/a, not all","The audit verifies findings run metadata names the one native child run, two prior extension fallthrough parent turns, native S01 ~$0.076, and prior extension $0.111","The audit verifies token-evidence.md scopes removed-command cost to earlier loaded-extension captures and records current extension S01 has no child token accounting","actual_eval_score=1101 with token_accounting_verified=1"],"isolation_proof":{"native":"No native runtime rerun; only wording and consistency checks were updated from existing token/live evidence.","pi_subagents":"No extension or native agent execution; the audit reads existing token evidence and current load-failure artifacts."},"why_not_overfit":"This guards against a real contradiction introduced by the live S01 run. It fails if future docs claim no model calls, omit native S01 cost, omit extension no-child caveat, or fail to scope prior extension fallthrough costs.","next_action_hint":"Next useful step is likely final review/cleanup or finalize; rerun live extension probes only after the module-format load failure is fixed.","limitations":["The audit uses footer-visible costs and rounded prompt-token counts; exact cache accounting remains unavailable.","It does not add new runtime behavior evidence; it reconciles existing token/cost evidence.","Observed cost cents combines native S01 child and prior extension fallthrough costs for audit visibility, not as a benchmark objective."]}}
{"run":73,"commit":"c51ae02","metric":1159,"metrics":{"startup_captures":2,"scenario_captures":26,"isolation_verified":1,"scorecard_rows_touched":18,"findings_sections_touched":9,"task_agent_coverage":10,"source_probe_coverage":12,"honest_limitations":106,"required_file_count":20,"bash_syntax_ok":1,"python_syntax_ok":1,"scorecard_evidence_rows":18,"evidence_file_coverage":18,"evidence_manifest_rows":18,"live_capture_links":10,"version_guard_verified":1,"token_evidence_rows":7,"native_zero_cost_captures":3,"removed_command_token_captures":2,"fallthrough_cost_cents":11.1,"token_evidence_verified":1,"scorecard_numeric_rows":18,"scorecard_numeric_cells":108,"scorecard_average_consistency":1,"scorecard_numeric_native_wins":7,"scorecard_numeric_subagents_wins":2,"scorecard_numeric_ties":0,"scorecard_analysis_rows":9,"scorecard_analysis_verified":1,"findings_alignment_rows":9,"findings_alignment_aligned":5,"findings_alignment_exceptions":4,"findings_alignment_conflicts":0,"findings_alignment_verified":1,"command_surface_rows":11,"command_surface_native_expected_present":3,"command_surface_extension_expected_present":5,"command_surface_extension_removed_absent":3,"command_surface_launch_isolation":2,"command_surface_removed_changelog_verified":1,"command_surface_subagents_runtime_loaded":0,"command_surface_subagents_runtime_load_failed":1,"command_surface_verified":1,"live_child_rows":2,"live_native_child_completed":1,"live_native_child_read_tool":1,"live_native_child_exact_three":1,"live_native_child_tokens":1958,"live_native_child_cost_cents":7.6,"live_subagents_load_error":1,"live_subagents_module_format_error":1,"live_subagents_shell_fallthrough":1,"live_subagents_no_child_started":1,"live_child_output_verified":1,"extension_load_audit_rows":6,"extension_load_runtime_error_files":2,"extension_load_module_format_error_files":2,"extension_load_manifest_verified":1,"extension_load_entry_default_export":1,"extension_load_entry_cjs_exports_absent":1,"extension_load_entry_top_level_await_absent":1,"extension_load_loader_jiti_verified":1,"extension_load_diagnosis_verified":1,"capture_timeline_rows":14,"capture_timeline_timestamped":14,"capture_timeline_prior_subagents_successes":7,"capture_timeline_current_subagents_failures":2,"capture_timeline_temporal_order_verified":1,"capture_timeline_mixed_state_documented":1,"capture_timeline_verified":1,"stale_policy_rows":6,"stale_policy_manifest_prior_rows":3,"stale_policy_scorecard_prior_rows":3,"stale_policy_current_failure_linked":1,"stale_policy_timeline_linked":1,"stale_policy_token_caveat":1,"stale_policy_rerun_trigger":1,"stale_policy_verified":1,"token_accounting_rows":7,"token_accounting_native_zero_rows":3,"token_accounting_native_child_cost_present":1,"token_accounting_extension_removed_cost_present":1,"token_accounting_current_extension_no_child_present":1,"token_accounting_scorecard_intro_aligned":1,"token_accounting_findings_metadata_aligned":1,"token_accounting_token_conclusion_caveated":1,"token_accounting_observed_cost_cents":18.7,"token_accounting_verified":1,"repro_hygiene_rows":5,"repro_hygiene_python_glob":1,"repro_hygiene_no_py_compile":1,"repro_hygiene_compile_in_memory":1,"repro_hygiene_pycache_clean":1,"repro_hygiene_verified":1,"scenario_verdict_rows":18,"scenario_verdict_current_live_rows":4,"scenario_verdict_current_failure_rows":1,"scenario_verdict_prior_live_rows":3,"scenario_verdict_source_backed_rows":10,"scenario_verdict_unknown_rows":0,"scenario_verdict_scorecard_prior_rows":3,"scenario_verdict_scorecard_current_failure":1,"scenario_verdict_scorecard_native_live_child":1,"scenario_verdict_findings_no_stale_false_claim":1,"scenario_verdict_findings_one_tiny_live_claim":1,"scenario_verdict_findings_current_failure_claim":1,"scenario_verdict_verified":1,"task_lifecycle_acceptance_rows":16,"task_lifecycle_native_fields_present":0,"task_lifecycle_native_actions_present":0,"task_lifecycle_native_statuses_present":0,"task_lifecycle_native_absent":1,"task_lifecycle_delegation_preserved":1,"task_lifecycle_extension_rows":12,"task_lifecycle_extension_management_actions":9,"task_lifecycle_extension_equivalent_absent":1,"task_lifecycle_audit_verified":1},"status":"keep","description":"Add reproducible scorer hygiene audit","timestamp":1777829050021,"segment":13,"confidence":3.632,"asi":{"hypothesis":"Repeated scorer runs were creating Python bytecode-cache churn through py_compile, which makes the eval less reproducible and risks accidental dirty worktree noise. Replacing py_compile with in-memory syntax compilation and auditing pycache cleanliness should improve runner hygiene without touching production Pi source.","evidence":["autoresearch.sh now syntax-checks scripts/check-*.py dynamically with compile(Path(filename).read_text(), filename, \"exec\") instead of python -m py_compile","repro-hygiene.md records five hygiene checks: check-script glob, no py_compile command, in-memory compile, clean scripts/__pycache__, and verified status","scripts/check-repro-hygiene.py verifies git status --porcelain -- scripts/__pycache__ is clean during the scorer run","run_experiment ./autoresearch.sh passed with repro_hygiene_verified=1 and no scripts/__pycache__ status output after a direct scorer run","actual_eval_score=1159"],"isolation_proof":{"native":"No native runtime or child-agent rerun; this changed only the eval runner and documentation artifacts.","pi_subagents":"No pi-subagents extension/tool execution; no runtime probes or token-spending prompts were repeated."},"why_not_overfit":"This addresses a real reproducibility flaw in the harness itself: prior py_compile syntax checks dirtied tracked/untracked __pycache__ files. The audit fails if py_compile returns, if new check scripts are not globbed, or if scripts/__pycache__ becomes dirty after running the scorer.","next_action_hint":"Next useful step is final review/cleanup or finalize. Do not add more artifact-only gates unless they catch a concrete contradiction or reproducibility failure.","limitations":["The audit checks scripts/__pycache__ only, not every possible Python bytecode cache under the repo.","It improves eval runner hygiene; it does not add new native-vs-extension behavioral evidence.","The repo already has tracked pycache files, so this guard verifies cleanliness rather than deleting tracked historical artifacts."]}}
