{"run":99,"commit":"83f9991","metric":2171,"metrics":{"startup_captures":2,"scenario_captures":26,"isolation_verified":1,"scorecard_rows_touched":18,"findings_sections_touched":9,"task_agent_coverage":10,"source_probe_coverage":12,"honest_limitations":106,"required_file_count":34,"bash_syntax_ok":1,"python_syntax_ok":1,"scorecard_evidence_rows":18,"evidence_file_coverage":18,"evidence_manifest_rows":18,"live_capture_links":10,"version_guard_verified":1,"token_evidence_rows":7,"native_zero_cost_captures":3,"removed_command_token_captures":2,"fallthrough_cost_cents":11.1,"token_evidence_verified":1,"scorecard_numeric_rows":18,"scorecard_numeric_cells":108,"scorecard_average_consistency":1,"scorecard_numeric_native_wins":8,"scorecard_numeric_subagents_wins":1,"scorecard_numeric_ties":0,"scorecard_analysis_rows":9,"scorecard_analysis_verified":1,"findings_alignment_rows":9,"findings_alignment_aligned":5,"findings_alignment_exceptions":4,"findings_alignment_conflicts":0,"findings_alignment_verified":1,"command_surface_rows":11,"command_surface_native_expected_present":3,"command_surface_extension_expected_present":5,"command_surface_extension_removed_absent":3,"command_surface_launch_isolation":2,"command_surface_removed_changelog_verified":1,"command_surface_subagents_runtime_loaded":0,"command_surface_subagents_runtime_load_failed":1,"command_surface_markdown_guardrail_split":1,"command_surface_verified":1,"live_child_rows":2,"live_native_child_completed":1,"live_native_child_read_tool":1,"live_native_child_exact_three":1,"live_native_child_tokens":1958,"live_native_child_cost_cents":7.6,"live_subagents_load_error":1,"live_subagents_module_format_error":1,"live_subagents_shell_fallthrough":1,"live_subagents_no_child_started":1,"live_child_output_verified":1,"extension_load_audit_rows":6,"extension_load_runtime_error_files":2,"extension_load_module_format_error_files":2,"extension_load_manifest_verified":1,"extension_load_entry_default_export":1,"extension_load_entry_cjs_exports_absent":1,"extension_load_entry_top_level_await_absent":1,"extension_load_loader_jiti_verified":1,"extension_load_diagnosis_verified":1,"capture_timeline_rows":14,"capture_timeline_timestamped":14,"capture_timeline_prior_subagents_successes":7,"capture_timeline_current_subagents_failures":2,"capture_timeline_temporal_order_verified":1,"capture_timeline_mixed_state_documented":1,"capture_timeline_verified":1,"stale_policy_rows":6,"stale_policy_manifest_prior_rows":3,"stale_policy_scorecard_prior_rows":3,"stale_policy_current_failure_linked":1,"stale_policy_timeline_linked":1,"stale_policy_token_caveat":1,"stale_policy_rerun_trigger":1,"stale_policy_verified":1,"token_accounting_rows":7,"token_accounting_native_zero_rows":3,"token_accounting_native_child_cost_present":1,"token_accounting_extension_removed_cost_present":1,"token_accounting_current_extension_no_child_present":1,"token_accounting_scorecard_intro_aligned":1,"token_accounting_findings_metadata_aligned":1,"token_accounting_token_conclusion_caveated":1,"token_accounting_observed_cost_cents":18.7,"token_accounting_verified":1,"repro_hygiene_rows":5,"repro_hygiene_python_glob":1,"repro_hygiene_no_py_compile":1,"repro_hygiene_compile_in_memory":1,"repro_hygiene_pycache_clean":1,"repro_hygiene_verified":1,"recommendation_consistency_rows":6,"recommendation_exec_runtime_caveat":1,"recommendation_s05_caveat":1,"recommendation_final_blocks_current_runtime":1,"recommendation_native_default":1,"recommendation_rerun_trigger":1,"recommendation_removed_slash_protection":1,"recommendation_consistency_verified":1,"native_control_source_markers_expected":8,"native_control_source_markers":8,"native_control_status_source":1,"native_control_status_capture":1,"native_control_source_capture":1,"native_control_source_probe_markers":1,"native_control_source_probe_disambiguation":1,"native_control_source_probe_tests_reference":1,"native_control_currentness_tests_interpretation":1,"native_control_scorecard_current":1,"native_control_findings_current":1,"native_control_readme_current":1,"native_control_no_stale_unsupported":1,"native_control_interpretation_bullets_split":1,"native_control_markdown_rows":13,"native_control_currentness_verified":1,"native_control_tool_schema_background_present":1,"native_control_executor_background_present":1,"native_control_status_implementation_present":1,"native_control_unit_running_status_test":1,"native_control_unit_interrupt_cancel_test":1,"native_control_unit_resume_test":1,"native_control_scorecard_unit_test_evidence":1,"native_control_findings_unit_test_evidence":1,"native_control_findings_audit_reference":1,"native_control_scorecard_paid_caveat":1,"native_control_capture_paid_caveat":1,"native_control_test_rows":13,"native_control_tests_verified":1,"rerun_readme_commands_expected":34,"rerun_readme_commands_present":34,"rerun_runbook_anchors_expected":23,"rerun_runbook_anchors_present":23,"rerun_readme_removed_manager_probe":1,"rerun_readme_live_child_checker":1,"rerun_readme_write_generators":1,"rerun_commands_verified":1,"eval_plan_currentness_rows":6,"eval_plan_s01_native_live_child":1,"eval_plan_s01_subagents_load_failure":1,"eval_plan_no_stale_no_live_child":1,"eval_plan_runtime_caveat":1,"eval_plan_token_caveat":1,"eval_plan_secondary_metrics_delegated":1,"eval_plan_currentness_verified":1,"scorecard_template_rows":18,"scorecard_template_warning":1,"scorecard_template_current_columns":1,"scorecard_template_placeholder_rows":18,"scorecard_template_no_stale_claims":1,"scorecard_template_verified":1,"findings_template_headings_expected":18,"findings_template_headings_present":18,"findings_template_warning":1,"findings_template_placeholder_count":128,"findings_template_no_stale_claims":1,"findings_template_verified":1,"eval_design_prompt_warning":1,"eval_design_prompt_current_caveats_expected":12,"eval_design_prompt_current_caveats":12,"eval_design_prompt_no_stale_lines":1,"eval_design_prompt_verified":1,"artifact_index_required_files":34,"artifact_index_readme_required_present":34,"artifact_index_readme_directory_entries":2,"artifact_index_manifest_audited_expected":25,"artifact_index_manifest_audited_present":25,"artifact_index_runbook_audited_expected":25,"artifact_index_runbook_audited_present":25,"artifact_index_autoresearch_scope_expected":34,"artifact_index_autoresearch_scope_present":34,"artifact_index_required_files_exist":34,"artifact_index_verified":1,"scenario_verdict_rows":18,"scenario_verdict_current_live_rows":4,"scenario_verdict_current_failure_rows":1,"scenario_verdict_prior_live_rows":3,"scenario_verdict_source_backed_rows":10,"scenario_verdict_unknown_rows":0,"scenario_verdict_scorecard_prior_rows":3,"scenario_verdict_scorecard_current_failure":1,"scenario_verdict_scorecard_native_live_child":1,"scenario_verdict_findings_no_stale_false_claim":1,"scenario_verdict_findings_one_tiny_live_claim":1,"scenario_verdict_findings_current_failure_claim":1,"scenario_verdict_verified":1,"source_runtime_extension_source_rows":5,"source_runtime_scorecard_rows_caveated":5,"source_runtime_manifest_rows_caveated":5,"source_runtime_eval_plan_rows_caveated":5,"source_runtime_eval_plan_global_caveat":1,"source_runtime_scenario_rule_caveat":1,"source_runtime_boundary_verified":1,"capture_integrity_scorecard_rows":18,"capture_integrity_expected_files":18,"capture_integrity_scorecard_files_covered":18,"capture_integrity_files_present":18,"capture_integrity_markers_expected":77,"capture_integrity_markers_present":77,"capture_integrity_verified":1,"task_lifecycle_acceptance_rows":16,"task_lifecycle_native_fields_present":0,"task_lifecycle_native_actions_present":0,"task_lifecycle_native_statuses_present":0,"task_lifecycle_native_control_fields_present":3,"task_lifecycle_native_control_actions_present":5,"task_lifecycle_native_control_not_task_lifecycle":1,"task_lifecycle_native_absent":1,"task_lifecycle_delegation_preserved":1,"task_lifecycle_extension_rows":12,"task_lifecycle_extension_management_actions":9,"task_lifecycle_extension_equivalent_absent":1,"task_lifecycle_audit_verified":1},"status":"keep","description":"Add scorecard capture integrity marker audit","timestamp":1777836600422,"segment":13,"confidence":4.660194174757281,"asi":{"hypothesis":"Existing evidence integrity only checked that scorecard capture paths existed; a marker-level capture integrity audit should catch stale, swapped, or placeholder capture files and make the scorecard's evidence claims more reproducible.","evidence":"./autoresearch.sh passed with actual_eval_score=2171; capture_integrity_scorecard_rows=18, expected_files=18, markers_present=77/77, verified=1.","next_action_hint":"Continue concrete reviewer sweep. Look for stale reviewer-handoff/backlog wording or unguarded final-report claims; avoid paid live probes."}}
{"run":100,"commit":"9ff48e2","metric":2184,"metrics":{"startup_captures":2,"scenario_captures":26,"isolation_verified":1,"scorecard_rows_touched":18,"findings_sections_touched":9,"task_agent_coverage":10,"source_probe_coverage":12,"honest_limitations":106,"required_file_count":34,"bash_syntax_ok":1,"python_syntax_ok":1,"scorecard_evidence_rows":18,"evidence_file_coverage":18,"evidence_manifest_rows":18,"live_capture_links":10,"version_guard_verified":1,"token_evidence_rows":7,"native_zero_cost_captures":3,"removed_command_token_captures":2,"fallthrough_cost_cents":11.1,"token_evidence_verified":1,"scorecard_numeric_rows":18,"scorecard_numeric_cells":108,"scorecard_average_consistency":1,"scorecard_numeric_native_wins":8,"scorecard_numeric_subagents_wins":1,"scorecard_numeric_ties":0,"scorecard_analysis_rows":9,"scorecard_analysis_verified":1,"findings_alignment_rows":9,"findings_alignment_aligned":5,"findings_alignment_exceptions":4,"findings_alignment_conflicts":0,"findings_alignment_verified":1,"command_surface_rows":11,"command_surface_native_expected_present":3,"command_surface_extension_expected_present":5,"command_surface_extension_removed_absent":3,"command_surface_launch_isolation":2,"command_surface_removed_changelog_verified":1,"command_surface_subagents_runtime_loaded":0,"command_surface_subagents_runtime_load_failed":1,"command_surface_markdown_guardrail_split":1,"command_surface_verified":1,"live_child_rows":2,"live_native_child_completed":1,"live_native_child_read_tool":1,"live_native_child_exact_three":1,"live_native_child_tokens":1958,"live_native_child_cost_cents":7.6,"live_subagents_load_error":1,"live_subagents_module_format_error":1,"live_subagents_shell_fallthrough":1,"live_subagents_no_child_started":1,"live_child_output_verified":1,"extension_load_audit_rows":6,"extension_load_runtime_error_files":2,"extension_load_module_format_error_files":2,"extension_load_manifest_verified":1,"extension_load_entry_default_export":1,"extension_load_entry_cjs_exports_absent":1,"extension_load_entry_top_level_await_absent":1,"extension_load_loader_jiti_verified":1,"extension_load_diagnosis_verified":1,"capture_timeline_rows":14,"capture_timeline_timestamped":14,"capture_timeline_prior_subagents_successes":7,"capture_timeline_current_subagents_failures":2,"capture_timeline_temporal_order_verified":1,"capture_timeline_mixed_state_documented":1,"capture_timeline_verified":1,"stale_policy_rows":6,"stale_policy_manifest_prior_rows":3,"stale_policy_scorecard_prior_rows":3,"stale_policy_current_failure_linked":1,"stale_policy_timeline_linked":1,"stale_policy_token_caveat":1,"stale_policy_rerun_trigger":1,"stale_policy_verified":1,"token_accounting_rows":7,"token_accounting_native_zero_rows":3,"token_accounting_native_child_cost_present":1,"token_accounting_extension_removed_cost_present":1,"token_accounting_current_extension_no_child_present":1,"token_accounting_scorecard_intro_aligned":1,"token_accounting_findings_metadata_aligned":1,"token_accounting_token_conclusion_caveated":1,"token_accounting_observed_cost_cents":18.7,"token_accounting_verified":1,"repro_hygiene_rows":5,"repro_hygiene_python_glob":1,"repro_hygiene_no_py_compile":1,"repro_hygiene_compile_in_memory":1,"repro_hygiene_pycache_clean":1,"repro_hygiene_verified":1,"recommendation_consistency_rows":6,"recommendation_exec_runtime_caveat":1,"recommendation_s05_caveat":1,"recommendation_final_blocks_current_runtime":1,"recommendation_native_default":1,"recommendation_rerun_trigger":1,"recommendation_removed_slash_protection":1,"recommendation_consistency_verified":1,"native_control_source_markers_expected":8,"native_control_source_markers":8,"native_control_status_source":1,"native_control_status_capture":1,"native_control_source_capture":1,"native_control_source_probe_markers":1,"native_control_source_probe_disambiguation":1,"native_control_source_probe_tests_reference":1,"native_control_currentness_tests_interpretation":1,"native_control_scorecard_current":1,"native_control_findings_current":1,"native_control_readme_current":1,"native_control_no_stale_unsupported":1,"native_control_interpretation_bullets_split":1,"native_control_markdown_rows":13,"native_control_currentness_verified":1,"native_control_tool_schema_background_present":1,"native_control_executor_background_present":1,"native_control_status_implementation_present":1,"native_control_unit_running_status_test":1,"native_control_unit_interrupt_cancel_test":1,"native_control_unit_resume_test":1,"native_control_scorecard_unit_test_evidence":1,"native_control_findings_unit_test_evidence":1,"native_control_findings_audit_reference":1,"native_control_scorecard_paid_caveat":1,"native_control_capture_paid_caveat":1,"native_control_test_rows":13,"native_control_tests_verified":1,"rerun_readme_commands_expected":34,"rerun_readme_commands_present":34,"rerun_runbook_anchors_expected":23,"rerun_runbook_anchors_present":23,"rerun_readme_removed_manager_probe":1,"rerun_readme_live_child_checker":1,"rerun_readme_write_generators":1,"rerun_commands_verified":1,"eval_plan_currentness_rows":6,"eval_plan_s01_native_live_child":1,"eval_plan_s01_subagents_load_failure":1,"eval_plan_no_stale_no_live_child":1,"eval_plan_runtime_caveat":1,"eval_plan_token_caveat":1,"eval_plan_secondary_metrics_delegated":1,"eval_plan_currentness_verified":1,"scorecard_template_rows":18,"scorecard_template_warning":1,"scorecard_template_current_columns":1,"scorecard_template_placeholder_rows":18,"scorecard_template_no_stale_claims":1,"scorecard_template_verified":1,"findings_template_headings_expected":18,"findings_template_headings_present":18,"findings_template_warning":1,"findings_template_placeholder_count":128,"findings_template_no_stale_claims":1,"findings_template_verified":1,"eval_design_prompt_warning":1,"eval_design_prompt_current_caveats_expected":12,"eval_design_prompt_current_caveats":12,"eval_design_prompt_no_stale_lines":1,"eval_design_prompt_verified":1,"artifact_index_required_files":34,"artifact_index_readme_required_present":34,"artifact_index_readme_directory_entries":2,"artifact_index_manifest_audited_expected":25,"artifact_index_manifest_audited_present":25,"artifact_index_runbook_audited_expected":25,"artifact_index_runbook_audited_present":25,"artifact_index_autoresearch_scope_expected":34,"artifact_index_autoresearch_scope_present":34,"artifact_index_required_files_exist":34,"artifact_index_markdown_rows":8,"artifact_index_markdown_guardrail_split":1,"artifact_index_verified":1,"scenario_verdict_rows":18,"scenario_verdict_current_live_rows":4,"scenario_verdict_current_failure_rows":1,"scenario_verdict_prior_live_rows":3,"scenario_verdict_source_backed_rows":10,"scenario_verdict_unknown_rows":0,"scenario_verdict_scorecard_prior_rows":3,"scenario_verdict_scorecard_current_failure":1,"scenario_verdict_scorecard_native_live_child":1,"scenario_verdict_findings_no_stale_false_claim":1,"scenario_verdict_findings_one_tiny_live_claim":1,"scenario_verdict_findings_current_failure_claim":1,"scenario_verdict_verified":1,"source_runtime_extension_source_rows":5,"source_runtime_scorecard_rows_caveated":5,"source_runtime_manifest_rows_caveated":5,"source_runtime_eval_plan_rows_caveated":5,"source_runtime_eval_plan_global_caveat":1,"source_runtime_scenario_rule_caveat":1,"source_runtime_boundary_verified":1,"capture_integrity_scorecard_rows":18,"capture_integrity_expected_files":18,"capture_integrity_scorecard_files_covered":18,"capture_integrity_files_present":18,"capture_integrity_markers_expected":77,"capture_integrity_markers_present":77,"capture_integrity_verified":1,"task_lifecycle_acceptance_rows":16,"task_lifecycle_native_fields_present":0,"task_lifecycle_native_actions_present":0,"task_lifecycle_native_statuses_present":0,"task_lifecycle_native_control_fields_present":3,"task_lifecycle_native_control_actions_present":5,"task_lifecycle_native_control_not_task_lifecycle":1,"task_lifecycle_native_absent":1,"task_lifecycle_delegation_preserved":1,"task_lifecycle_extension_rows":12,"task_lifecycle_extension_management_actions":9,"task_lifecycle_extension_equivalent_absent":1,"task_lifecycle_audit_verified":1},"status":"keep","description":"Fix artifact-index fused markdown row and add guard","timestamp":1777836763995,"segment":13,"confidence":5.040417209908735,"asi":{"hypothesis":"artifact-index.md had a generated markdown row-join bug where manifest and runbook audit rows rendered as one table row; fixing the generator and adding a split guard should preserve reviewer readability and catch recurrence.","evidence":"grep found fused artifact-index rows; after fix ./autoresearch.sh passed with actual_eval_score=2184, artifact_index_markdown_rows=8, artifact_index_markdown_guardrail_split=1.","next_action_hint":"Continue concrete generated-artifact/stale-claim sweep; search for fused markdown rows or stale handoff/backlog wording."}}
