{"run":74,"commit":"f4fc24b","metric":1226,"metrics":{"startup_captures":2,"scenario_captures":26,"isolation_verified":1,"scorecard_rows_touched":18,"findings_sections_touched":9,"task_agent_coverage":10,"source_probe_coverage":12,"honest_limitations":106,"required_file_count":21,"bash_syntax_ok":1,"python_syntax_ok":1,"scorecard_evidence_rows":18,"evidence_file_coverage":18,"evidence_manifest_rows":18,"live_capture_links":10,"version_guard_verified":1,"token_evidence_rows":7,"native_zero_cost_captures":3,"removed_command_token_captures":2,"fallthrough_cost_cents":11.1,"token_evidence_verified":1,"scorecard_numeric_rows":18,"scorecard_numeric_cells":108,"scorecard_average_consistency":1,"scorecard_numeric_native_wins":7,"scorecard_numeric_subagents_wins":2,"scorecard_numeric_ties":0,"scorecard_analysis_rows":9,"scorecard_analysis_verified":1,"findings_alignment_rows":9,"findings_alignment_aligned":5,"findings_alignment_exceptions":4,"findings_alignment_conflicts":0,"findings_alignment_verified":1,"command_surface_rows":11,"command_surface_native_expected_present":3,"command_surface_extension_expected_present":5,"command_surface_extension_removed_absent":3,"command_surface_launch_isolation":2,"command_surface_removed_changelog_verified":1,"command_surface_subagents_runtime_loaded":0,"command_surface_subagents_runtime_load_failed":1,"command_surface_verified":1,"live_child_rows":2,"live_native_child_completed":1,"live_native_child_read_tool":1,"live_native_child_exact_three":1,"live_native_child_tokens":1958,"live_native_child_cost_cents":7.6,"live_subagents_load_error":1,"live_subagents_module_format_error":1,"live_subagents_shell_fallthrough":1,"live_subagents_no_child_started":1,"live_child_output_verified":1,"extension_load_audit_rows":6,"extension_load_runtime_error_files":2,"extension_load_module_format_error_files":2,"extension_load_manifest_verified":1,"extension_load_entry_default_export":1,"extension_load_entry_cjs_exports_absent":1,"extension_load_entry_top_level_await_absent":1,"extension_load_loader_jiti_verified":1,"extension_load_diagnosis_verified":1,"capture_timeline_rows":14,"capture_timeline_timestamped":14,"capture_timeline_prior_subagents_successes":7,"capture_timeline_current_subagents_failures":2,"capture_timeline_temporal_order_verified":1,"capture_timeline_mixed_state_documented":1,"capture_timeline_verified":1,"stale_policy_rows":6,"stale_policy_manifest_prior_rows":3,"stale_policy_scorecard_prior_rows":3,"stale_policy_current_failure_linked":1,"stale_policy_timeline_linked":1,"stale_policy_token_caveat":1,"stale_policy_rerun_trigger":1,"stale_policy_verified":1,"token_accounting_rows":7,"token_accounting_native_zero_rows":3,"token_accounting_native_child_cost_present":1,"token_accounting_extension_removed_cost_present":1,"token_accounting_current_extension_no_child_present":1,"token_accounting_scorecard_intro_aligned":1,"token_accounting_findings_metadata_aligned":1,"token_accounting_token_conclusion_caveated":1,"token_accounting_observed_cost_cents":18.7,"token_accounting_verified":1,"repro_hygiene_rows":5,"repro_hygiene_python_glob":1,"repro_hygiene_no_py_compile":1,"repro_hygiene_compile_in_memory":1,"repro_hygiene_pycache_clean":1,"repro_hygiene_verified":1,"recommendation_consistency_rows":6,"recommendation_exec_runtime_caveat":1,"recommendation_s05_caveat":1,"recommendation_final_blocks_current_runtime":1,"recommendation_native_default":1,"recommendation_rerun_trigger":1,"recommendation_removed_slash_protection":1,"recommendation_consistency_verified":1,"scenario_verdict_rows":18,"scenario_verdict_current_live_rows":4,"scenario_verdict_current_failure_rows":1,"scenario_verdict_prior_live_rows":3,"scenario_verdict_source_backed_rows":10,"scenario_verdict_unknown_rows":0,"scenario_verdict_scorecard_prior_rows":3,"scenario_verdict_scorecard_current_failure":1,"scenario_verdict_scorecard_native_live_child":1,"scenario_verdict_findings_no_stale_false_claim":1,"scenario_verdict_findings_one_tiny_live_claim":1,"scenario_verdict_findings_current_failure_claim":1,"scenario_verdict_verified":1,"task_lifecycle_acceptance_rows":16,"task_lifecycle_native_fields_present":0,"task_lifecycle_native_actions_present":0,"task_lifecycle_native_statuses_present":0,"task_lifecycle_native_absent":1,"task_lifecycle_delegation_preserved":1,"task_lifecycle_extension_rows":12,"task_lifecycle_extension_management_actions":9,"task_lifecycle_extension_equivalent_absent":1,"task_lifecycle_audit_verified":1},"status":"keep","description":"Add recommendation consistency guard","timestamp":1777829259252,"segment":13,"confidence":3.6654135338345863,"asi":{"hypothesis":"The final recommendation still risked implying pi-subagents was currently usable for async/control despite the documented fresh-load failure. A recommendation consistency guard should preserve the source/tool-schema async-control finding while gating runtime use on fixing and rerunning the loader failure.","evidence":["findings.md now says pi-subagents is the source/tool-schema winner for async/control only, with current runtime use blocked until the module-format load failure is fixed and rerun","S05 now states pi-subagents has the strongest source/tool-schema surface but current runtime availability is blocked","The final recommendation now says not to rely on the current installed pi-subagents runtime until the load failure is fixed and S01 plus cheap command probes are rerun","recommendation-consistency.md records six checks and scripts/check-recommendation-consistency.py verifies all pass","actual_eval_score=1226 with recommendation_consistency_verified=1"],"isolation_proof":{"native":"No native runtime or child-agent rerun; changes are final-report wording plus a consistency checker.","pi_subagents":"No pi-subagents runtime/tool execution; the guard reads existing findings/docs and preserves the current load-failure verdict."},"why_not_overfit":"This fixes a concrete report contradiction rather than padding a benchmark: source-level async/control value was being recommended without enough runtime caveat. The guard fails if the recommendation stops naming the load failure, omits rerun requirements, drops native as default, or stops protecting removed slash surfaces.","next_action_hint":"Next useful step is final review/cleanup or finalize. Additional gates should only be added for concrete contradictions or reproducibility bugs.","limitations":["The guard checks final guidance wording, not runtime behavior.","It intentionally preserves pi-subagents as a source/tool-schema async-control reference despite current runtime unavailability.","If the loader failure is fixed, rerun extension probes and update this recommendation rather than preserving the caveat."]}}
{"run":75,"commit":"da08922","metric":1295,"metrics":{"startup_captures":2,"scenario_captures":26,"isolation_verified":1,"scorecard_rows_touched":18,"findings_sections_touched":9,"task_agent_coverage":10,"source_probe_coverage":12,"honest_limitations":107,"required_file_count":22,"bash_syntax_ok":1,"python_syntax_ok":1,"scorecard_evidence_rows":18,"evidence_file_coverage":18,"evidence_manifest_rows":18,"live_capture_links":10,"version_guard_verified":1,"token_evidence_rows":7,"native_zero_cost_captures":3,"removed_command_token_captures":2,"fallthrough_cost_cents":11.1,"token_evidence_verified":1,"scorecard_numeric_rows":18,"scorecard_numeric_cells":108,"scorecard_average_consistency":1,"scorecard_numeric_native_wins":7,"scorecard_numeric_subagents_wins":2,"scorecard_numeric_ties":0,"scorecard_analysis_rows":9,"scorecard_analysis_verified":1,"findings_alignment_rows":9,"findings_alignment_aligned":5,"findings_alignment_exceptions":4,"findings_alignment_conflicts":0,"findings_alignment_verified":1,"command_surface_rows":11,"command_surface_native_expected_present":3,"command_surface_extension_expected_present":5,"command_surface_extension_removed_absent":3,"command_surface_launch_isolation":2,"command_surface_removed_changelog_verified":1,"command_surface_subagents_runtime_loaded":0,"command_surface_subagents_runtime_load_failed":1,"command_surface_verified":1,"live_child_rows":2,"live_native_child_completed":1,"live_native_child_read_tool":1,"live_native_child_exact_three":1,"live_native_child_tokens":1958,"live_native_child_cost_cents":7.6,"live_subagents_load_error":1,"live_subagents_module_format_error":1,"live_subagents_shell_fallthrough":1,"live_subagents_no_child_started":1,"live_child_output_verified":1,"extension_load_audit_rows":6,"extension_load_runtime_error_files":2,"extension_load_module_format_error_files":2,"extension_load_manifest_verified":1,"extension_load_entry_default_export":1,"extension_load_entry_cjs_exports_absent":1,"extension_load_entry_top_level_await_absent":1,"extension_load_loader_jiti_verified":1,"extension_load_diagnosis_verified":1,"capture_timeline_rows":14,"capture_timeline_timestamped":14,"capture_timeline_prior_subagents_successes":7,"capture_timeline_current_subagents_failures":2,"capture_timeline_temporal_order_verified":1,"capture_timeline_mixed_state_documented":1,"capture_timeline_verified":1,"stale_policy_rows":6,"stale_policy_manifest_prior_rows":3,"stale_policy_scorecard_prior_rows":3,"stale_policy_current_failure_linked":1,"stale_policy_timeline_linked":1,"stale_policy_token_caveat":1,"stale_policy_rerun_trigger":1,"stale_policy_verified":1,"token_accounting_rows":7,"token_accounting_native_zero_rows":3,"token_accounting_native_child_cost_present":1,"token_accounting_extension_removed_cost_present":1,"token_accounting_current_extension_no_child_present":1,"token_accounting_scorecard_intro_aligned":1,"token_accounting_findings_metadata_aligned":1,"token_accounting_token_conclusion_caveated":1,"token_accounting_observed_cost_cents":18.7,"token_accounting_verified":1,"repro_hygiene_rows":5,"repro_hygiene_python_glob":1,"repro_hygiene_no_py_compile":1,"repro_hygiene_compile_in_memory":1,"repro_hygiene_pycache_clean":1,"repro_hygiene_verified":1,"recommendation_consistency_rows":6,"recommendation_exec_runtime_caveat":1,"recommendation_s05_caveat":1,"recommendation_final_blocks_current_runtime":1,"recommendation_native_default":1,"recommendation_rerun_trigger":1,"recommendation_removed_slash_protection":1,"recommendation_consistency_verified":1,"rerun_readme_commands_expected":24,"rerun_readme_commands_present":24,"rerun_runbook_anchors_expected":13,"rerun_runbook_anchors_present":13,"rerun_readme_removed_manager_probe":1,"rerun_readme_live_child_checker":1,"rerun_readme_write_generators":1,"rerun_commands_verified":1,"scenario_verdict_rows":18,"scenario_verdict_current_live_rows":4,"scenario_verdict_current_failure_rows":1,"scenario_verdict_prior_live_rows":3,"scenario_verdict_source_backed_rows":10,"scenario_verdict_unknown_rows":0,"scenario_verdict_scorecard_prior_rows":3,"scenario_verdict_scorecard_current_failure":1,"scenario_verdict_scorecard_native_live_child":1,"scenario_verdict_findings_no_stale_false_claim":1,"scenario_verdict_findings_one_tiny_live_claim":1,"scenario_verdict_findings_current_failure_claim":1,"scenario_verdict_verified":1,"task_lifecycle_acceptance_rows":16,"task_lifecycle_native_fields_present":0,"task_lifecycle_native_actions_present":0,"task_lifecycle_native_statuses_present":0,"task_lifecycle_native_absent":1,"task_lifecycle_delegation_preserved":1,"task_lifecycle_extension_rows":12,"task_lifecycle_extension_management_actions":9,"task_lifecycle_extension_equivalent_absent":1,"task_lifecycle_audit_verified":1},"status":"keep","description":"Add rerun command coverage audit","timestamp":1777829492140,"segment":13,"confidence":3.367741935483871,"asi":{"hypothesis":"README's quick-run block was missing preserved rerun steps, especially the /subagents removed-command probe and generated-artifact checks, so a rerun command coverage audit should improve reproducibility without adding behavioral claims.","evidence":["README.md quick-run now includes subagents-s07-manager-removed-live '/subagents' so the preserved removed-manager fallthrough capture is reproducible","README.md now includes check-live-child-output.py, check-command-surface.py --write, check-scorecard-consistency.py --write score-analysis.md, check-findings-alignment.py, and check-task-lifecycle.py before ./autoresearch.sh","rerun-commands.md records README command coverage 24/24 and runbook anchors 13/13","scripts/check-rerun-commands.py verifies the removed manager probe, live-child checker, and write generators are present","actual_eval_score=1295 with rerun_commands_verified=1"],"isolation_proof":{"native":"No native runtime or child-agent rerun; only documentation commands and a static command-coverage checker changed.","pi_subagents":"No pi-subagents extension/tool execution; this documents the command needed to reproduce the preserved prior fallthrough probe but does not rerun it."},"why_not_overfit":"This fixes a concrete reproducibility gap: following README could fail to regenerate evidence required by token/fallthrough checks. The guard fails if required capture or checker commands disappear from README/runbook.","next_action_hint":"Next useful step is final review/cleanup or finalize. Avoid adding new gates unless they catch a concrete contradiction, missing rerun step, or reproducibility bug.","limitations":["The audit checks command snippets are documented; it does not execute the full rerun sequence because that would spend tokens and alter captures.","Some commands remain intentionally source-backed or conditional; the audit focuses on preserved live/fallthrough and generated-artifact commands.","If the extension loader is fixed, update the rerun command set to reflect fresh current-runtime probes."]}}
{"run":76,"commit":"10a3e5e","metric":1403,"metrics":{"startup_captures":2,"scenario_captures":26,"isolation_verified":1,"scorecard_rows_touched":18,"findings_sections_touched":9,"task_agent_coverage":10,"source_probe_coverage":12,"honest_limitations":107,"required_file_count":23,"bash_syntax_ok":1,"python_syntax_ok":1,"scorecard_evidence_rows":18,"evidence_file_coverage":18,"evidence_manifest_rows":18,"live_capture_links":10,"version_guard_verified":1,"token_evidence_rows":7,"native_zero_cost_captures":3,"removed_command_token_captures":2,"fallthrough_cost_cents":11.1,"token_evidence_verified":1,"scorecard_numeric_rows":18,"scorecard_numeric_cells":108,"scorecard_average_consistency":1,"scorecard_numeric_native_wins":7,"scorecard_numeric_subagents_wins":2,"scorecard_numeric_ties":0,"scorecard_analysis_rows":9,"scorecard_analysis_verified":1,"findings_alignment_rows":9,"findings_alignment_aligned":5,"findings_alignment_exceptions":4,"findings_alignment_conflicts":0,"findings_alignment_verified":1,"command_surface_rows":11,"command_surface_native_expected_present":3,"command_surface_extension_expected_present":5,"command_surface_extension_removed_absent":3,"command_surface_launch_isolation":2,"command_surface_removed_changelog_verified":1,"command_surface_subagents_runtime_loaded":0,"command_surface_subagents_runtime_load_failed":1,"command_surface_verified":1,"live_child_rows":2,"live_native_child_completed":1,"live_native_child_read_tool":1,"live_native_child_exact_three":1,"live_native_child_tokens":1958,"live_native_child_cost_cents":7.6,"live_subagents_load_error":1,"live_subagents_module_format_error":1,"live_subagents_shell_fallthrough":1,"live_subagents_no_child_started":1,"live_child_output_verified":1,"extension_load_audit_rows":6,"extension_load_runtime_error_files":2,"extension_load_module_format_error_files":2,"extension_load_manifest_verified":1,"extension_load_entry_default_export":1,"extension_load_entry_cjs_exports_absent":1,"extension_load_entry_top_level_await_absent":1,"extension_load_loader_jiti_verified":1,"extension_load_diagnosis_verified":1,"capture_timeline_rows":14,"capture_timeline_timestamped":14,"capture_timeline_prior_subagents_successes":7,"capture_timeline_current_subagents_failures":2,"capture_timeline_temporal_order_verified":1,"capture_timeline_mixed_state_documented":1,"capture_timeline_verified":1,"stale_policy_rows":6,"stale_policy_manifest_prior_rows":3,"stale_policy_scorecard_prior_rows":3,"stale_policy_current_failure_linked":1,"stale_policy_timeline_linked":1,"stale_policy_token_caveat":1,"stale_policy_rerun_trigger":1,"stale_policy_verified":1,"token_accounting_rows":7,"token_accounting_native_zero_rows":3,"token_accounting_native_child_cost_present":1,"token_accounting_extension_removed_cost_present":1,"token_accounting_current_extension_no_child_present":1,"token_accounting_scorecard_intro_aligned":1,"token_accounting_findings_metadata_aligned":1,"token_accounting_token_conclusion_caveated":1,"token_accounting_observed_cost_cents":18.7,"token_accounting_verified":1,"repro_hygiene_rows":5,"repro_hygiene_python_glob":1,"repro_hygiene_no_py_compile":1,"repro_hygiene_compile_in_memory":1,"repro_hygiene_pycache_clean":1,"repro_hygiene_verified":1,"recommendation_consistency_rows":6,"recommendation_exec_runtime_caveat":1,"recommendation_s05_caveat":1,"recommendation_final_blocks_current_runtime":1,"recommendation_native_default":1,"recommendation_rerun_trigger":1,"recommendation_removed_slash_protection":1,"recommendation_consistency_verified":1,"rerun_readme_commands_expected":24,"rerun_readme_commands_present":24,"rerun_runbook_anchors_expected":13,"rerun_runbook_anchors_present":13,"rerun_readme_removed_manager_probe":1,"rerun_readme_live_child_checker":1,"rerun_readme_write_generators":1,"rerun_commands_verified":1,"artifact_index_required_files":23,"artifact_index_readme_required_present":23,"artifact_index_readme_directory_entries":2,"artifact_index_manifest_audited_expected":17,"artifact_index_manifest_audited_present":17,"artifact_index_required_files_exist":23,"artifact_index_verified":1,"scenario_verdict_rows":18,"scenario_verdict_current_live_rows":4,"scenario_verdict_current_failure_rows":1,"scenario_verdict_prior_live_rows":3,"scenario_verdict_source_backed_rows":10,"scenario_verdict_unknown_rows":0,"scenario_verdict_scorecard_prior_rows":3,"scenario_verdict_scorecard_current_failure":1,"scenario_verdict_scorecard_native_live_child":1,"scenario_verdict_findings_no_stale_false_claim":1,"scenario_verdict_findings_one_tiny_live_claim":1,"scenario_verdict_findings_current_failure_claim":1,"scenario_verdict_verified":1,"task_lifecycle_acceptance_rows":16,"task_lifecycle_native_fields_present":0,"task_lifecycle_native_actions_present":0,"task_lifecycle_native_statuses_present":0,"task_lifecycle_native_absent":1,"task_lifecycle_delegation_preserved":1,"task_lifecycle_extension_rows":12,"task_lifecycle_extension_management_actions":9,"task_lifecycle_extension_equivalent_absent":1,"task_lifecycle_audit_verified":1},"status":"keep","description":"Add artifact index synchronization audit","timestamp":1777829748617,"segment":13,"confidence":3.4698795180722892,"asi":{"hypothesis":"As audit artifacts accumulated, README, evidence-manifest, and autoresearch.sh required_files became separate artifact indexes that could drift. A synchronization audit should catch missing artifact index entries before reviewers follow stale docs.","evidence":["artifact-index.md records required files 23, README required files present 23/23, README directory entries 2, manifest audited artifacts 17/17, and required files exist 23/23","scripts/check-artifact-index.py parses autoresearch.sh required_files, README Fresh artifacts, and evidence-manifest global evidence entries","README.md now lists README.md itself and artifact-index.md in Fresh artifacts","evidence-manifest.md now lists artifact-index.md as global evidence","actual_eval_score=1403 with artifact_index_verified=1"],"isolation_proof":{"native":"No native runtime or child-agent rerun; this only synchronizes artifact indexes and adds a static checker.","pi_subagents":"No pi-subagents extension/tool execution; no captures or token-spending probes were rerun."},"why_not_overfit":"This addresses a real maintenance failure mode from the growing evidence set: required files can be omitted from README or audited artifacts can be omitted from the evidence manifest. The check fails if any index drifts.","next_action_hint":"Next useful step is final review/cleanup or finalize. Avoid adding new artifact gates unless they catch a concrete contradiction, missing rerun step, or reproducibility bug.","limitations":["The manifest check intentionally covers audited evidence artifacts, not every base narrative file such as README or eval-plan.","The audit validates indexes, not the semantic correctness of each artifact.","If new artifact categories are added, update AUDITED_GLOBAL_ARTIFACTS deliberately."]}}
