{"run":77,"commit":"7991877","metric":1481,"metrics":{"startup_captures":2,"scenario_captures":26,"isolation_verified":1,"scorecard_rows_touched":18,"findings_sections_touched":9,"task_agent_coverage":10,"source_probe_coverage":12,"honest_limitations":107,"required_file_count":24,"bash_syntax_ok":1,"python_syntax_ok":1,"scorecard_evidence_rows":18,"evidence_file_coverage":18,"evidence_manifest_rows":18,"live_capture_links":10,"version_guard_verified":1,"token_evidence_rows":7,"native_zero_cost_captures":3,"removed_command_token_captures":2,"fallthrough_cost_cents":11.1,"token_evidence_verified":1,"scorecard_numeric_rows":18,"scorecard_numeric_cells":108,"scorecard_average_consistency":1,"scorecard_numeric_native_wins":7,"scorecard_numeric_subagents_wins":2,"scorecard_numeric_ties":0,"scorecard_analysis_rows":9,"scorecard_analysis_verified":1,"findings_alignment_rows":9,"findings_alignment_aligned":5,"findings_alignment_exceptions":4,"findings_alignment_conflicts":0,"findings_alignment_verified":1,"command_surface_rows":11,"command_surface_native_expected_present":3,"command_surface_extension_expected_present":5,"command_surface_extension_removed_absent":3,"command_surface_launch_isolation":2,"command_surface_removed_changelog_verified":1,"command_surface_subagents_runtime_loaded":0,"command_surface_subagents_runtime_load_failed":1,"command_surface_verified":1,"live_child_rows":2,"live_native_child_completed":1,"live_native_child_read_tool":1,"live_native_child_exact_three":1,"live_native_child_tokens":1958,"live_native_child_cost_cents":7.6,"live_subagents_load_error":1,"live_subagents_module_format_error":1,"live_subagents_shell_fallthrough":1,"live_subagents_no_child_started":1,"live_child_output_verified":1,"extension_load_audit_rows":6,"extension_load_runtime_error_files":2,"extension_load_module_format_error_files":2,"extension_load_manifest_verified":1,"extension_load_entry_default_export":1,"extension_load_entry_cjs_exports_absent":1,"extension_load_entry_top_level_await_absent":1,"extension_load_loader_jiti_verified":1,"extension_load_diagnosis_verified":1,"capture_timeline_rows":14,"capture_timeline_timestamped":14,"capture_timeline_prior_subagents_successes":7,"capture_timeline_current_subagents_failures":2,"capture_timeline_temporal_order_verified":1,"capture_timeline_mixed_state_documented":1,"capture_timeline_verified":1,"stale_policy_rows":6,"stale_policy_manifest_prior_rows":3,"stale_policy_scorecard_prior_rows":3,"stale_policy_current_failure_linked":1,"stale_policy_timeline_linked":1,"stale_policy_token_caveat":1,"stale_policy_rerun_trigger":1,"stale_policy_verified":1,"token_accounting_rows":7,"token_accounting_native_zero_rows":3,"token_accounting_native_child_cost_present":1,"token_accounting_extension_removed_cost_present":1,"token_accounting_current_extension_no_child_present":1,"token_accounting_scorecard_intro_aligned":1,"token_accounting_findings_metadata_aligned":1,"token_accounting_token_conclusion_caveated":1,"token_accounting_observed_cost_cents":18.7,"token_accounting_verified":1,"repro_hygiene_rows":5,"repro_hygiene_python_glob":1,"repro_hygiene_no_py_compile":1,"repro_hygiene_compile_in_memory":1,"repro_hygiene_pycache_clean":1,"repro_hygiene_verified":1,"recommendation_consistency_rows":6,"recommendation_exec_runtime_caveat":1,"recommendation_s05_caveat":1,"recommendation_final_blocks_current_runtime":1,"recommendation_native_default":1,"recommendation_rerun_trigger":1,"recommendation_removed_slash_protection":1,"recommendation_consistency_verified":1,"rerun_readme_commands_expected":27,"rerun_readme_commands_present":27,"rerun_runbook_anchors_expected":16,"rerun_runbook_anchors_present":16,"rerun_readme_removed_manager_probe":1,"rerun_readme_live_child_checker":1,"rerun_readme_write_generators":1,"rerun_commands_verified":1,"eval_plan_currentness_rows":6,"eval_plan_s01_native_live_child":1,"eval_plan_s01_subagents_load_failure":1,"eval_plan_no_stale_no_live_child":1,"eval_plan_runtime_caveat":1,"eval_plan_token_caveat":1,"eval_plan_secondary_metrics_delegated":1,"eval_plan_currentness_verified":1,"artifact_index_required_files":24,"artifact_index_readme_required_present":24,"artifact_index_readme_directory_entries":2,"artifact_index_manifest_audited_expected":18,"artifact_index_manifest_audited_present":18,"artifact_index_required_files_exist":24,"artifact_index_verified":1,"scenario_verdict_rows":18,"scenario_verdict_current_live_rows":4,"scenario_verdict_current_failure_rows":1,"scenario_verdict_prior_live_rows":3,"scenario_verdict_source_backed_rows":10,"scenario_verdict_unknown_rows":0,"scenario_verdict_scorecard_prior_rows":3,"scenario_verdict_scorecard_current_failure":1,"scenario_verdict_scorecard_native_live_child":1,"scenario_verdict_findings_no_stale_false_claim":1,"scenario_verdict_findings_one_tiny_live_claim":1,"scenario_verdict_findings_current_failure_claim":1,"scenario_verdict_verified":1,"task_lifecycle_acceptance_rows":16,"task_lifecycle_native_fields_present":0,"task_lifecycle_native_actions_present":0,"task_lifecycle_native_statuses_present":0,"task_lifecycle_native_absent":1,"task_lifecycle_delegation_preserved":1,"task_lifecycle_extension_rows":12,"task_lifecycle_extension_management_actions":9,"task_lifecycle_extension_equivalent_absent":1,"task_lifecycle_audit_verified":1},"status":"keep","description":"Add eval-plan currentness audit","timestamp":1777830083656,"segment":13,"confidence":3.4943181818181817,"asi":{"hypothesis":"A reviewer pass found a concrete stale artifact: eval-plan.md still described S01 as source-backed with no live child even after the native S01 live probe and current pi-subagents load failure were added. Updating the plan and adding a currentness audit should prevent planning prose from contradicting the evidence set.","evidence":["eval-plan.md S01 now names the live /agents run scout child and the current /run scout load failure instead of saying both arms have no live child","eval-plan-currentness.md records 6/6 currentness checks passing","scripts/check-eval-plan-currentness.py verifies S01 native live child wording, extension load-failure wording, absence of stale no-live-child wording, runtime caveat, token caveat, and secondary-metric delegation","rerun-commands.md now requires 27 README commands and 16 runbook anchors, including the eval-plan currentness checker","artifact-index.md now records 24 required files and 18/18 manifest audited artifacts","actual_eval_score=1481 with eval_plan_currentness_verified=1"],"isolation_proof":{"native":"No native runtime or child-agent rerun; the change corrects static planning/audit artifacts after prior evidence was already captured.","pi_subagents":"No pi-subagents extension/tool execution; the current load failure is documented from existing captures and source-backed artifacts."},"why_not_overfit":"This was driven by a real contradiction discovered during review: eval-plan.md still claimed S01 had no live child. The audit protects semantic correctness of the eval plan rather than rewarding arbitrary new files.","next_action_hint":"Next useful step is final review/cleanup or finalize. Only add another gate if it catches a concrete stale claim or reproducibility bug; do not rerun extension live probes until the module-format load failure is fixed.","limitations":["The checker focuses on the stale S01/live-token/runtime caveats that actually drifted; it is not a full natural-language proof of eval-plan correctness.","It updates planning and audit artifacts only, not production Pi source or live captures."]}}
{"run":78,"commit":"d44317c","metric":1487,"metrics":{"startup_captures":2,"scenario_captures":26,"isolation_verified":1,"scorecard_rows_touched":18,"findings_sections_touched":9,"task_agent_coverage":10,"source_probe_coverage":12,"honest_limitations":107,"required_file_count":24,"bash_syntax_ok":1,"python_syntax_ok":1,"scorecard_evidence_rows":18,"evidence_file_coverage":18,"evidence_manifest_rows":18,"live_capture_links":10,"version_guard_verified":1,"token_evidence_rows":7,"native_zero_cost_captures":3,"removed_command_token_captures":2,"fallthrough_cost_cents":11.1,"token_evidence_verified":1,"scorecard_numeric_rows":18,"scorecard_numeric_cells":108,"scorecard_average_consistency":1,"scorecard_numeric_native_wins":7,"scorecard_numeric_subagents_wins":2,"scorecard_numeric_ties":0,"scorecard_analysis_rows":9,"scorecard_analysis_verified":1,"findings_alignment_rows":9,"findings_alignment_aligned":5,"findings_alignment_exceptions":4,"findings_alignment_conflicts":0,"findings_alignment_verified":1,"command_surface_rows":11,"command_surface_native_expected_present":3,"command_surface_extension_expected_present":5,"command_surface_extension_removed_absent":3,"command_surface_launch_isolation":2,"command_surface_removed_changelog_verified":1,"command_surface_subagents_runtime_loaded":0,"command_surface_subagents_runtime_load_failed":1,"command_surface_markdown_guardrail_split":1,"command_surface_verified":1,"live_child_rows":2,"live_native_child_completed":1,"live_native_child_read_tool":1,"live_native_child_exact_three":1,"live_native_child_tokens":1958,"live_native_child_cost_cents":7.6,"live_subagents_load_error":1,"live_subagents_module_format_error":1,"live_subagents_shell_fallthrough":1,"live_subagents_no_child_started":1,"live_child_output_verified":1,"extension_load_audit_rows":6,"extension_load_runtime_error_files":2,"extension_load_module_format_error_files":2,"extension_load_manifest_verified":1,"extension_load_entry_default_export":1,"extension_load_entry_cjs_exports_absent":1,"extension_load_entry_top_level_await_absent":1,"extension_load_loader_jiti_verified":1,"extension_load_diagnosis_verified":1,"capture_timeline_rows":14,"capture_timeline_timestamped":14,"capture_timeline_prior_subagents_successes":7,"capture_timeline_current_subagents_failures":2,"capture_timeline_temporal_order_verified":1,"capture_timeline_mixed_state_documented":1,"capture_timeline_verified":1,"stale_policy_rows":6,"stale_policy_manifest_prior_rows":3,"stale_policy_scorecard_prior_rows":3,"stale_policy_current_failure_linked":1,"stale_policy_timeline_linked":1,"stale_policy_token_caveat":1,"stale_policy_rerun_trigger":1,"stale_policy_verified":1,"token_accounting_rows":7,"token_accounting_native_zero_rows":3,"token_accounting_native_child_cost_present":1,"token_accounting_extension_removed_cost_present":1,"token_accounting_current_extension_no_child_present":1,"token_accounting_scorecard_intro_aligned":1,"token_accounting_findings_metadata_aligned":1,"token_accounting_token_conclusion_caveated":1,"token_accounting_observed_cost_cents":18.7,"token_accounting_verified":1,"repro_hygiene_rows":5,"repro_hygiene_python_glob":1,"repro_hygiene_no_py_compile":1,"repro_hygiene_compile_in_memory":1,"repro_hygiene_pycache_clean":1,"repro_hygiene_verified":1,"recommendation_consistency_rows":6,"recommendation_exec_runtime_caveat":1,"recommendation_s05_caveat":1,"recommendation_final_blocks_current_runtime":1,"recommendation_native_default":1,"recommendation_rerun_trigger":1,"recommendation_removed_slash_protection":1,"recommendation_consistency_verified":1,"rerun_readme_commands_expected":27,"rerun_readme_commands_present":27,"rerun_runbook_anchors_expected":16,"rerun_runbook_anchors_present":16,"rerun_readme_removed_manager_probe":1,"rerun_readme_live_child_checker":1,"rerun_readme_write_generators":1,"rerun_commands_verified":1,"eval_plan_currentness_rows":6,"eval_plan_s01_native_live_child":1,"eval_plan_s01_subagents_load_failure":1,"eval_plan_no_stale_no_live_child":1,"eval_plan_runtime_caveat":1,"eval_plan_token_caveat":1,"eval_plan_secondary_metrics_delegated":1,"eval_plan_currentness_verified":1,"artifact_index_required_files":24,"artifact_index_readme_required_present":24,"artifact_index_readme_directory_entries":2,"artifact_index_manifest_audited_expected":18,"artifact_index_manifest_audited_present":18,"artifact_index_required_files_exist":24,"artifact_index_verified":1,"scenario_verdict_rows":18,"scenario_verdict_current_live_rows":4,"scenario_verdict_current_failure_rows":1,"scenario_verdict_prior_live_rows":3,"scenario_verdict_source_backed_rows":10,"scenario_verdict_unknown_rows":0,"scenario_verdict_scorecard_prior_rows":3,"scenario_verdict_scorecard_current_failure":1,"scenario_verdict_scorecard_native_live_child":1,"scenario_verdict_findings_no_stale_false_claim":1,"scenario_verdict_findings_one_tiny_live_claim":1,"scenario_verdict_findings_current_failure_claim":1,"scenario_verdict_verified":1,"task_lifecycle_acceptance_rows":16,"task_lifecycle_native_fields_present":0,"task_lifecycle_native_actions_present":0,"task_lifecycle_native_statuses_present":0,"task_lifecycle_native_absent":1,"task_lifecycle_delegation_preserved":1,"task_lifecycle_extension_rows":12,"task_lifecycle_extension_management_actions":9,"task_lifecycle_extension_equivalent_absent":1,"task_lifecycle_audit_verified":1},"status":"keep","description":"Fix command-surface markdown guardrail split","timestamp":1777830284989,"segment":13,"confidence":3.2526315789473683,"asi":{"hypothesis":"A reviewer pass found a concrete generated-artifact bug in command-surface.md: the extension-load audit bullet and the /subagents reappearance warning were concatenated into one malformed bullet, making an important drift guard easy to miss. Fixing the generator and adding a guard metric should preserve handoff readability without changing behavioral claims.","evidence":["command-surface.md now has separate bullets for `Extension load audit: extension-load-audit.md` and the `/subagents` or `/subagents-status` reappearance warning","scripts/check-command-surface.py now writes those bullets separately and verifies command_surface_markdown_guardrail_split=1","scripts/check-command-surface.py --write now returns success after regenerating the file, even if regeneration is needed","autoresearch.sh emits command_surface_markdown_guardrail_split=1 and actual_eval_score=1487","runbook.md and evidence-manifest.md document that command-surface validation covers the markdown guardrail split"],"isolation_proof":{"native":"No native runtime or child-agent run; this only fixes generated Markdown and static validation.","pi_subagents":"No pi-subagents extension/tool execution; current failure evidence remains from existing captures."},"why_not_overfit":"This was not invented to pad the metric: grep exposed a malformed line in a reviewer-facing guardrail. The fix changes the generator so reproduction no longer emits that malformed Markdown.","next_action_hint":"Next useful step is final review/cleanup or finalize. Only add more checks for concrete defects found by review; do not rerun extension live probes until the module-format load failure is fixed.","limitations":["The guard only checks this known command-surface bullet split, not all possible Markdown formatting issues.","No behavioral scenario was rerun; this improves artifact clarity and reproduction quality only."]}}
